video_id,url,title,channel_name,published_at,view_count,persons_found,total_persons
Htti4Ne10d0,https://youtu.be/Htti4Ne10d0,"Late Night Nightmare w/ Kimmel, Meyers, Colbert, Fallon, Letterman & Noah",The Late Late Show with James Corden,2023-04-28T05:35:00Z,4200138,"Jimmy Fallon,Jimmy Kimmel",2
bflgj1-cdnE,https://youtu.be/bflgj1-cdnE,Tucker Carlson Isn't Much of a Tucker,The Late Late Show with James Corden,2023-04-25T05:52:17Z,335269,"Joe Biden,Tucker Carlson",2
2F4neZl_9mQ,https://youtu.be/2F4neZl_9mQ,Kim Kardashian recalls her career as a closet organizer for Paris Hilton #shorts #kimkardashian ￼,The Late Late Show with James Corden,2023-04-12T20:40:17Z,1490740,"Kim Kardashian,Paris Hilton",2
_H6QdL1hkLg,https://youtu.be/_H6QdL1hkLg,Donald Trump Wants His Perp Walk Moment,The Late Late Show with James Corden,2023-03-23T05:35:00Z,171823,"Donald Trump,Joe Biden",2
jHIWuE3G9Aw,https://youtu.be/jHIWuE3G9Aw,Bad Bunny Carpool Karaoke,The Late Late Show with James Corden,2023-03-15T04:40:00Z,11139604,"Ariana Grande,Harry Styles",2
BFWR8tDulD8,https://youtu.be/BFWR8tDulD8,How Did You Do In Your Oscars Pool?,The Late Late Show with James Corden,2023-03-14T05:44:19Z,185678,"Harrison Ford,Lady Gaga",2
WVwRoiX-0yo,https://youtu.be/WVwRoiX-0yo,Prince William & Kate's Wax Figures Are a Royal Mistake,The Late Late Show with James Corden,2023-03-08T07:25:13Z,285820,"Kate Middleton,King Charles",2
2-A6ykI3OmM,https://youtu.be/2-A6ykI3OmM,The State of Our Union Is Pretty Weird,The Late Late Show with James Corden,2023-02-09T06:35:00Z,226779,"George Santos,Joe Biden",2
1AbG70fho5k,https://youtu.be/1AbG70fho5k,The Last Late Late Show: Chapter 5 — One Year To Say Goodbye,The Late Late Show with James Corden,2023-05-25T13:00:01Z,237743,Tom Cruise,1
AeEYQ62t8hA,https://youtu.be/AeEYQ62t8hA,The Final Episode - FULL - The Late Late Show with James Corden,The Late Late Show with James Corden,2023-04-28T08:35:00Z,9375589,Harry Styles,1
bb0ud41Eumw,https://youtu.be/bb0ud41Eumw,Tom Cruise & James Join 'The Lion King' Cast,The Late Late Show with James Corden,2023-04-28T02:54:06Z,6114471,Tom Cruise,1
_bsehjkcLW8,https://youtu.be/_bsehjkcLW8,We've Known Billie Eilish for 6 Years,The Late Late Show with James Corden,2023-04-26T08:35:00Z,1399597,Billie Eilish,1
s0eGTy8LGVE,https://youtu.be/s0eGTy8LGVE,The Late Late Lifetime Achievement Award,The Late Late Show with James Corden,2023-04-25T05:51:40Z,110998,Harry Styles,1
GbwutLxlLW0,https://youtu.be/GbwutLxlLW0,Ben Affleck Had a Bad Roommate In Matt Damon,The Late Late Show with James Corden,2023-04-14T08:35:00Z,312269,Ben Affleck,1
JY9fKhHu_Rc,https://youtu.be/JY9fKhHu_Rc,Ben Affleck Was Cut from the 'Buffy' Movie,The Late Late Show with James Corden,2023-04-14T08:35:00Z,142989,Ben Affleck,1
fmKRHKeDbw8,https://youtu.be/fmKRHKeDbw8,President Biden's & His Tiny Irish Desk,The Late Late Show with James Corden,2023-04-14T05:38:44Z,121652,King Charles,1
jZgmQIzkt8g,https://youtu.be/jZgmQIzkt8g,Kim Kardashian’s acting chops tho 👏 #shorts #kimkardashian,The Late Late Show with James Corden,2023-04-12T18:36:58Z,1627729,Kim Kardashian,1
zBWd5zrTEaY,https://youtu.be/zBWd5zrTEaY,There's Only 12 of These Left...,The Late Late Show with James Corden,2023-04-11T06:23:53Z,108207,Donald Trump,1
O0VWxH8JbhU,https://youtu.be/O0VWxH8JbhU,Spill Your Guts with Kendall Jenner and Harry Styles #shorts #harrystyles #kendalljenner,The Late Late Show with James Corden,2023-04-10T15:49:12Z,9674342,Harry Styles,1
rJ7T8lXPhhI,https://youtu.be/rJ7T8lXPhhI,Trump Arrest Watch: Why Is House Arrest Bad?,The Late Late Show with James Corden,2023-03-22T05:44:46Z,126366,Donald Trump,1
aDxOHAEfLyQ,https://youtu.be/aDxOHAEfLyQ,So They're Finally Going to Arrest Trump?,The Late Late Show with James Corden,2023-03-21T05:35:00Z,181350,Donald Trump,1
WBsDwlBBJlY,https://youtu.be/WBsDwlBBJlY,Bad Bunny jams out to Ariana Grande during Carpool Karaoke #badbunny #shorts,The Late Late Show with James Corden,2023-03-15T05:08:17Z,408688,Ariana Grande,1
dA0CiTVW8PA,https://youtu.be/dA0CiTVW8PA,Katy Perry Rescued Niall Horan’s X-Factor Audition,The Late Late Show with James Corden,2023-02-17T09:35:00Z,684666,Katy Perry,1
hX9-vYKEAhI,https://youtu.be/hX9-vYKEAhI,Tilly & Adele Have Gordon Ramsay Considering 'Dancing' & Singing,The Late Late Show with James Corden,2023-02-09T09:35:00Z,119893,Arnold Schwarzenegger,1
L-fylr8vcsk,https://youtu.be/L-fylr8vcsk,"Lizzo, Harry, Beyoncé & Ted Have a Big GRAMMYs Night",The Late Late Show with James Corden,2023-02-07T06:35:00Z,256845,Ted Cruz,1
xIeP9RsiXvI,https://youtu.be/xIeP9RsiXvI,Corruption is Rampant in Top Candy Bars List,The Late Late Show with James Corden,2023-02-02T06:35:00Z,116594,Tom Brady,1
Y3ilHm1I1UQ,https://youtu.be/Y3ilHm1I1UQ,James Responds to Trump's Latest Lawsuit,The Late Late Show with James Corden,2023-02-01T06:35:00Z,138482,Donald Trump,1
a08zNhFhLII,https://youtu.be/a08zNhFhLII,"Keep the Health Opinions to Yourself, Canada",The Late Late Show with James Corden,2023-01-20T07:00:34Z,203439,Harrison Ford,1
ttpuEu2XzLE,https://youtu.be/ttpuEu2XzLE,The Night We Learn About Todgers,The Late Late Show with James Corden,2023-01-18T06:35:39Z,135893,Joe Biden,1
YP0LJBO7SfU,https://youtu.be/YP0LJBO7SfU,Take Gwyneth Paltrow Back to the '90s,The Late Late Show with James Corden,2023-01-10T09:35:00Z,151136,Gwyneth Paltrow,1
orsBVwaPWv8,https://youtu.be/orsBVwaPWv8,Prince Harry Gave a Spicy Tell-All,The Late Late Show with James Corden,2023-01-10T06:35:00Z,388196,Gwyneth Paltrow,1
2JmhAHx084o,https://youtu.be/2JmhAHx084o,"Elon Musk Stays Close to Trump While Sleeping, Taylor Swift Proposal Sparks Sports Bets",The Tonight Show Starring Jimmy Fallon,2025-01-31T04:36:06Z,214660,"Elon Musk,Jimmy Fallon,Taylor Swift,Travis Kelce",4
LmWy_AgVd4c,https://youtu.be/LmWy_AgVd4c,"Top Tech Moguls to Attend Trump's Inauguration, Americans Ditch TikTok for Chinese RedNote App",The Tonight Show Starring Jimmy Fallon,2025-01-15T04:35:00Z,244908,"Elon Musk,Jeff Bezos,Jimmy Fallon,Mark Zuckerberg",4
fh2qXHb48qs,https://youtu.be/fh2qXHb48qs,"Clingy Elon Driving Trump Crazy, Justin Trudeau Announces Resignation | The Tonight Show",The Tonight Show Starring Jimmy Fallon,2025-01-07T04:35:00Z,346556,"Donald Trump,Elon Musk,Jimmy Fallon,Justin Trudeau",4
Xp5YHZRWxKA,https://youtu.be/Xp5YHZRWxKA,Trump Taps Elon Musk and Fox News Host Pete Hegseth for Key White House Roles | The Tonight Show,The Tonight Show Starring Jimmy Fallon,2024-11-14T04:37:00Z,181003,"Elon Musk,Jimmy Fallon,Pete Hegseth,Vivek Ramaswamy",4
EHIg6N21rak,https://youtu.be/EHIg6N21rak,"Sacha Baron Cohen Moderates a Trump vs. Harris Debate as Borat, Talks Rudy Giuliani’s Borat Scene",The Tonight Show Starring Jimmy Fallon,2024-11-03T14:00:10Z,1169303,"Donald Trump,Jimmy Fallon,Kamala Harris,Rudy Giuliani",4
49AK3O9s8ok,https://youtu.be/49AK3O9s8ok,"Trump's Praise for Hitler Is Revealed, Obama Raps Eminem Lyrics at Harris Rally | The Tonight Show",The Tonight Show Starring Jimmy Fallon,2024-10-24T03:35:00Z,393790,"Barack Obama,Donald Trump,Jimmy Fallon,Kamala Harris",4
PwVC__qMjAs,https://youtu.be/PwVC__qMjAs,"Elon Musk Simps for Trump at Rally, Kamala Harris Joins the Daddy Gang | The Tonight Show",The Tonight Show Starring Jimmy Fallon,2024-10-08T03:35:02Z,347972,"Donald Trump,Elon Musk,Jimmy Fallon,Kamala Harris",4
tGwM8N0Lj5M,https://youtu.be/tGwM8N0Lj5M,"Chase Stokes Talks Outer Banks, Being Scared to Workout with Chris Hemsworth & Arnold Schwarzenegger",The Tonight Show Starring Jimmy Fallon,2024-10-04T04:06:00Z,118606,"Arnold Schwarzenegger,Chris Hemsworth,Jimmy Fallon,Kelsea Ballerini",4
ZUTvVPBxPC8,https://youtu.be/ZUTvVPBxPC8,"Keith Urban Shares His Met Gala Prank on Nicole Kidman; Covers ""Espresso"" by Sabrina Carpenter",The Tonight Show Starring Jimmy Fallon,2024-09-25T03:58:00Z,134331,"Jimmy Fallon,Keith Urban,Nicole Kidman,Sabrina Carpenter",4
W7GliiNcuEE,https://youtu.be/W7GliiNcuEE,"Trump Rejects Second Debate, Harris Campaign Sells Taylor Swift-Inspired Friendship Bracelets",The Tonight Show Starring Jimmy Fallon,2024-09-13T03:51:34Z,555608,"Donald Trump,Jimmy Fallon,Kamala Harris,Taylor Swift",4
XFkglYw8FbU,https://youtu.be/XFkglYw8FbU,"Trump Pushes Pet-Eating Immigrant Conspiracy at Debate, Taylor Swift Endorses Harris | Tonight Show",The Tonight Show Starring Jimmy Fallon,2024-09-12T03:40:51Z,571611,"Donald Trump,Jimmy Fallon,Kamala Harris,Taylor Swift",4
0tC9jW6bFC4,https://youtu.be/0tC9jW6bFC4,"Trump ""Prepares"" for Debate Amidst Cease & Desist, Elon Musk to Be First Trillionaire | Tonight Show",The Tonight Show Starring Jimmy Fallon,2024-09-10T03:35:03Z,358602,"Donald Trump,Elon Musk,Jimmy Fallon,Kamala Harris",4
ZjqHC0NNR2s,https://youtu.be/ZjqHC0NNR2s,"Tim Walz and J.D. Vance Agree to Debate, Support for Trump Shrinks Significantly | The Tonight Show",The Tonight Show Starring Jimmy Fallon,2024-08-16T03:35:00Z,562370,"Jimmy Fallon,Joe Biden,Kamala Harris,Tim Walz",4
UBG94KMoC1E,https://youtu.be/UBG94KMoC1E,"Kamala Harris Favored to Win Presidential Election, Elon Musk Interviews Trump Live on X",The Tonight Show Starring Jimmy Fallon,2024-08-14T03:35:00Z,507006,"Donald Trump,Elon Musk,Jimmy Fallon,Kamala Harris",4
UHdgiLXCuJc,https://youtu.be/UHdgiLXCuJc,Hugh Jackman and Ryan Reynolds Talk Deadpool & Wolverine and Play the Claw Machine Challenge,The Tonight Show Starring Jimmy Fallon,2024-08-06T13:00:29Z,462303,"Hugh Jackman,Jimmy Fallon,Ryan Reynolds,Taylor Swift",4
jhs9cxFfRtE,https://youtu.be/jhs9cxFfRtE,Ryan Reynolds Talks Potential Taylor Swift Deadpool & Wolverine Cameo and Possibility of Deadpool 4,The Tonight Show Starring Jimmy Fallon,2024-07-23T04:06:00Z,454820,"Hugh Jackman,Jimmy Fallon,Ryan Reynolds,Taylor Swift",4
V_fKayy7AKM,https://youtu.be/V_fKayy7AKM,Erin Andrews and Charissa Thompson Take Credit for Setting Up Taylor Swift and Travis Kelce,The Tonight Show Starring Jimmy Fallon,2024-05-24T04:06:00Z,150922,"Jimmy Fallon,Taylor Swift,Tom Brady,Travis Kelce",4
5Xe76iq-RSc,https://youtu.be/5Xe76iq-RSc,Robert De Niro on Working with Martin Scorsese and Being Jimmy's First Late Night Guest (Extended),The Tonight Show Starring Jimmy Fallon,2024-05-15T03:58:00Z,235222,"Jimmy Fallon,Martin Scorsese,Robert De Niro,Robert Downey Jr.",4
BJ4IGiodGtU,https://youtu.be/BJ4IGiodGtU,"John Krasinski on Working with Blake Lively, Ryan Reynolds, Bradley Cooper and More on IF (Extended)",The Tonight Show Starring Jimmy Fallon,2024-05-11T04:06:00Z,594608,"Blake Lively,George Clooney,Jimmy Fallon,Ryan Reynolds",4
NiIimKTo0Pw,https://youtu.be/NiIimKTo0Pw,"Trump Lags with Female Voters, Marjorie Taylor Greene Struggles to Pronounce ""Indictable""",The Tonight Show Starring Jimmy Fallon,2024-02-02T04:35:00Z,333757,"Jimmy Fallon,Marjorie Taylor Greene,Taylor Swift,Travis Kelce",4
ZZ9LyrupNIg,https://youtu.be/ZZ9LyrupNIg,Rob Gronkowski on His Dance-Off with Travis Kelce and Super Bowl LVIII Predictions,The Tonight Show Starring Jimmy Fallon,2024-01-30T04:58:00Z,368384,"Jimmy Fallon,Patrick Mahomes,Tom Brady,Travis Kelce",4
5kNHQysdJmc,https://youtu.be/5kNHQysdJmc,Justin Timberlake Was Tackled by Travis Kelce at a Golf Invitational | The Tonight Show,The Tonight Show Starring Jimmy Fallon,2024-01-26T05:30:01Z,671117,"Jimmy Fallon,Justin Timberlake,Patrick Mahomes,Travis Kelce",4
QIWohtuFVUM,https://youtu.be/QIWohtuFVUM,What's Behind Me? with Tom Cruise | The Tonight Show Starring Jimmy Fallon,The Tonight Show Starring Jimmy Fallon,2025-05-20T03:42:00Z,433481,"Bruce Springsteen,Jimmy Fallon,Tom Cruise",3
9RDKflRiyMg,https://youtu.be/9RDKflRiyMg,Jeremy Renner Shares How Reliving His Near-Death Experience in My Next Breath Helped Him Heal,The Tonight Show Starring Jimmy Fallon,2025-04-30T03:54:00Z,128475,"Jeremy Renner,Jimmy Fallon,Tom Cruise",3
-oh-w35v5qU,https://youtu.be/-oh-w35v5qU,Tom Cruise Insisted Rami Malek Get Weapons Training for The Amateur | The Tonight Show,The Tonight Show Starring Jimmy Fallon,2025-04-10T03:51:00Z,255708,"Jimmy Fallon,Steven Spielberg,Tom Cruise",3
awbaFPhoACA,https://youtu.be/awbaFPhoACA,"Ed Sheeran Reveals Album Title Play, Sings ""Old Phone"" and Talks Writing ""Shape of You"" for Rihanna",The Tonight Show Starring Jimmy Fallon,2025-03-27T03:50:00Z,556544,"Ed Sheeran,Jimmy Fallon,Justin Bieber",3
K80GWuclp3g,https://youtu.be/K80GWuclp3g,Jim Gaffigan on Taking His Bickering Kids on Vacation and Playing Tim Walz on SNL (Extended),The Tonight Show Starring Jimmy Fallon,2025-02-11T04:50:00Z,102756,"Jimmy Fallon,Pope Francis,Tim Walz",3
l11VCrkMV8U,https://youtu.be/l11VCrkMV8U,"Trump's Gulf of America Change Backed by Google, Elon Musk Turns X into Venmo | The Tonight Show",The Tonight Show Starring Jimmy Fallon,2025-01-29T04:35:01Z,263968,"Donald Trump,Elon Musk,Jimmy Fallon",3
ky_4Y1-Xyz4,https://youtu.be/ky_4Y1-Xyz4,"Trump, Biden, Obama and Bush Have Viral Reunion, Supreme Court Is TikTok's Last Hope | Tonight Show",The Tonight Show Starring Jimmy Fallon,2025-01-10T04:35:01Z,480254,"Barack Obama,Jimmy Carter,Jimmy Fallon",3
rY-RVP9r7SA,https://youtu.be/rY-RVP9r7SA,"Trump Threatens Greenland Invasion, Meta Taps MAGA-Backed Dana White for Board of Directors",The Tonight Show Starring Jimmy Fallon,2025-01-09T04:46:59Z,278873,"Dana White,Jimmy Fallon,Melania Trump",3
VD2InomKiIM,https://youtu.be/VD2InomKiIM,"Elon Musk Third Wheels Trump and Bezos, North Korean Hackers Stole Over $1B in Crypto | Tonight Show",The Tonight Show Starring Jimmy Fallon,2024-12-20T04:37:10Z,250157,"Elon Musk,Jeff Bezos,Jimmy Fallon",3
qIReytScpao,https://youtu.be/qIReytScpao,Elton John Answers Rapid-Fire Questions About His Most Perfect Song and More | Fallon Flashback,The Tonight Show Starring Jimmy Fallon,2024-12-15T14:00:49Z,142765,"Bob Dylan,Elton John,Jimmy Fallon",3
E1yrv6ci8yI,https://youtu.be/E1yrv6ci8yI,"Trump's ""Blow Job"" Blunder, Divided America Prepares for Historic Election | The Tonight Show",The Tonight Show Starring Jimmy Fallon,2024-11-05T04:35:00Z,478398,"Donald Trump,Jimmy Fallon,Kamala Harris",3
Fdfk-vwhOaI,https://youtu.be/Fdfk-vwhOaI,Trump Spews False 2024 Election Fraud Claims with Only Six Days Left | The Tonight Show,The Tonight Show Starring Jimmy Fallon,2024-10-31T03:35:00Z,300292,"Arnold Schwarzenegger,Jimmy Fallon,Kamala Harris",3
HtxJkfkIylo,https://youtu.be/HtxJkfkIylo,"Andrea Bocelli Teaches Jimmy How to Sing, Explains Why Ed Sheeran Showed Up at His House (Extended)",The Tonight Show Starring Jimmy Fallon,2024-10-30T04:06:00Z,340016,"Dua Lipa,Ed Sheeran,Jimmy Fallon",3
SdcCmALImUI,https://youtu.be/SdcCmALImUI,"Chris Martin Plays Coldplay's ""Yellow,"" Sings ""WE PRAY"" with Jimmy as Bruce Springsteen & More",The Tonight Show Starring Jimmy Fallon,2024-10-26T13:00:28Z,1322628,"Bob Dylan,Bruce Springsteen,Jimmy Fallon",3
2O2wgY5gLjY,https://youtu.be/2O2wgY5gLjY,Sacha Baron Cohen Moderates a Debate Between Trump and Harris as Borat and Ali G | The Tonight Show,The Tonight Show Starring Jimmy Fallon,2024-10-25T03:58:00Z,3618307,"Donald Trump,Jimmy Fallon,Kamala Harris",3
aJkTiTKhoB8,https://youtu.be/aJkTiTKhoB8,"Beyoncé to Take the Stage at Harris Rally, Yankees and Dodgers Face Off in the World Series",The Tonight Show Starring Jimmy Fallon,2024-10-25T03:34:46Z,394101,"Bruce Springsteen,Jimmy Fallon,Kamala Harris",3
Su2EXHFOb0E,https://youtu.be/Su2EXHFOb0E,"McDonald's Dodges Trump Endorsement After Staged Event, Eminem Introduces Obama at Harris Rally",The Tonight Show Starring Jimmy Fallon,2024-10-23T03:34:29Z,413578,"Barack Obama,Jimmy Fallon,Kamala Harris",3
asp7LRrLoec,https://youtu.be/asp7LRrLoec,"Trump Attempts to Troll Harris by Working at McDonald's, NY Liberty Win First WNBA Title",The Tonight Show Starring Jimmy Fallon,2024-10-22T03:35:00Z,447860,"Donald Trump,Jimmy Fallon,Kamala Harris",3
SE1Z9kGdyIg,https://youtu.be/SE1Z9kGdyIg,"Chris Martin Sings Coldplay's ""WE PRAY"" with Jimmy as Bruce Springsteen, Bob Dylan & More (Extended)",The Tonight Show Starring Jimmy Fallon,2024-10-04T03:58:00Z,688065,"Bob Dylan,Bruce Springsteen,Jimmy Fallon",3
cAM6PkEyLsE,https://youtu.be/cAM6PkEyLsE,"Jack Antonoff Talks Co-Producing Sabrina Carpenter's and Taylor Swift's Albums, Romeo + Juliet",The Tonight Show Starring Jimmy Fallon,2024-10-02T03:58:00Z,118845,"Jimmy Fallon,Sabrina Carpenter,Taylor Swift",3
lBnZYeJoPJY,https://youtu.be/lBnZYeJoPJY,"Trump Suggests The Purge to End Crime, JD Vance and Tim Walz Prepare for VP Debate | Tonight Show",The Tonight Show Starring Jimmy Fallon,2024-10-01T03:35:01Z,400414,"Jimmy Fallon,Kamala Harris,Tim Walz",3
lKff3amdVXo,https://youtu.be/lKff3amdVXo,"New York Mayor Eric Adams Indicted on Federal Charges, Trump's Shilling His Face on Coins",The Tonight Show Starring Jimmy Fallon,2024-09-27T03:35:00Z,236750,"Eric Adams,Jimmy Fallon,Tim Walz",3
yAvG9YHJMAs,https://youtu.be/yAvG9YHJMAs,"Trump Afraid to Debate Kamala Again, Biden Warns Against China at U.N. Assembly | The Tonight Show",The Tonight Show Starring Jimmy Fallon,2024-09-25T03:35:00Z,265470,"Donald Trump,Jimmy Fallon,Kamala Harris",3
Ufc7iNGCn5A,https://youtu.be/Ufc7iNGCn5A,"Trump Vows to Take U.S. to Mars, New York Hosts Crucial Gathering of World Leaders | Tonight Show",The Tonight Show Starring Jimmy Fallon,2024-09-24T03:35:00Z,352213,"Bruce Springsteen,Elon Musk,Jimmy Fallon",3
cDZw_5kp9AY,https://youtu.be/cDZw_5kp9AY,"Kamala Holds Massive Lead Over Trump Among LGBTQ+ Voters, The Golden Bachelorette Premieres",The Tonight Show Starring Jimmy Fallon,2024-09-19T03:37:25Z,312680,"Gavin Newsom,Jimmy Fallon,Kamala Harris",3
g68EFBToxCc,https://youtu.be/g68EFBToxCc,"Trump and Harris Meet for the First Time at Debate, Trump Leads Harris in Florida by Two Points",The Tonight Show Starring Jimmy Fallon,2024-09-11T03:34:48Z,607131,"Donald Trump,Jimmy Fallon,Kamala Harris",3
Ws6siJbgfzo,https://youtu.be/Ws6siJbgfzo,"Trump Gets Muted Mics in Debate, Coin Toss Will Determine Last Words | The Tonight Show",The Tonight Show Starring Jimmy Fallon,2024-09-06T04:50:38Z,331886,"Donald Trump,Jimmy Fallon,Kamala Harris",3
MWnfVCWzSMI,https://youtu.be/MWnfVCWzSMI,"Kamala Harris Wants Trump Rattled at Debate, Strategizing Ways to “Poke the Bear” | The Tonight Show",The Tonight Show Starring Jimmy Fallon,2024-09-04T03:35:02Z,546200,"Donald Trump,Jimmy Fallon,Kamala Harris",3
VgSlln21v3U,https://youtu.be/VgSlln21v3U,"Kamala Harris Accepts Democratic Nomination, Trump to Host Insurrection Awards Gala | Tonight Show",The Tonight Show Starring Jimmy Fallon,2024-08-23T04:07:04Z,491609,"Jimmy Fallon,Kamala Harris,Rudy Giuliani",3
bFXH08PozQQ,https://youtu.be/bFXH08PozQQ,"Trump Furious at Campaign Staff, Regrets Terrible Decision of Picking J.D. Vance | The Tonight Show",The Tonight Show Starring Jimmy Fallon,2024-08-15T03:32:00Z,403918,"Jimmy Fallon,Kamala Harris,Tim Walz",3
d4L3H5WMNts,https://youtu.be/d4L3H5WMNts,Mixtape Medley with Ariana Grande and Kelly Clarkson | That's My Jam,The Tonight Show Starring Jimmy Fallon,2024-07-30T14:00:33Z,3181878,"Ariana Grande,Jimmy Fallon,Kelly Clarkson",3
lq8xQvwxT_A,https://youtu.be/lq8xQvwxT_A,"Obamas Endorse Kamala Harris for President, 2024 Olympics Kick Off in Paris | The Tonight Show",The Tonight Show Starring Jimmy Fallon,2024-07-27T03:35:00Z,575049,"Jimmy Fallon,Kamala Harris,Michelle Obama",3
OJOXJMuLXdY,https://youtu.be/OJOXJMuLXdY,Ryan Reynolds and Hugh Jackman Perform a Song About Deadpool & Wolverine | The Tonight Show,The Tonight Show Starring Jimmy Fallon,2024-07-27T01:00:08Z,3108862,"Hugh Jackman,Jimmy Fallon,Ryan Reynolds",3
3XmLZqP0Byo,https://youtu.be/3XmLZqP0Byo,"Trump to Release Save America Book, J.D. Vance's Popularity Is in the Negatives | The Tonight Show",The Tonight Show Starring Jimmy Fallon,2024-07-26T03:35:00Z,522349,"Jimmy Fallon,Kamala Harris,Melania Trump",3
uXCR3fyATFE,https://youtu.be/uXCR3fyATFE,"Hugh Jackman on Reviving Wolverine, the Iconic Yellow Suit and Potential Deadpool & Wolverine Cameos",The Tonight Show Starring Jimmy Fallon,2024-07-24T03:50:00Z,1008593,"Hugh Jackman,Jimmy Fallon,Ryan Reynolds",3
H1BpS4mlsfk,https://youtu.be/H1BpS4mlsfk,Ryan Reynolds Makes His Grand Entrance Riding a Deadpool Float on The Tonight Show,The Tonight Show Starring Jimmy Fallon,2024-07-23T03:58:00Z,734010,"Hugh Jackman,Jimmy Fallon,Ryan Reynolds",3
Pjd7U6FYaWM,https://youtu.be/Pjd7U6FYaWM,Rita Ora Talks Hanging Out with Katy Perry at Taylor Swift's Eras Tour (Extended) | The Tonight Show,The Tonight Show Starring Jimmy Fallon,2024-07-10T04:20:00Z,137211,"Jimmy Fallon,Katy Perry,Taylor Swift",3
wkebBRNA5zE,https://youtu.be/wkebBRNA5zE,"Democrats Divided Over Biden's Future, Polls Reveal Hillary Clinton Would Lead Over Trump",The Tonight Show Starring Jimmy Fallon,2024-07-10T03:35:01Z,164102,"Elton John,Hillary Clinton,Jimmy Fallon",3
kTE3I-vOQnk,https://youtu.be/kTE3I-vOQnk,"Hunter Biden Found Guilty in Gun Trial, Rudy Giuliani Turns Himself In | The Tonight Show",The Tonight Show Starring Jimmy Fallon,2024-06-12T04:12:14Z,165562,"Hunter Biden,Jimmy Fallon,Rudy Giuliani",3
MoVcaQmtcl0,https://youtu.be/MoVcaQmtcl0,"Biden Attempts to Close Southern Border, Marjorie Taylor Greene Attacks Dr. Fauci | The Tonight Show",The Tonight Show Starring Jimmy Fallon,2024-06-05T03:35:00Z,180730,"Jimmy Fallon,Marjorie Taylor Greene,Morgan Wallen",3
l1WCyEWvBow,https://youtu.be/l1WCyEWvBow,Chris Pratt on The Terminal List's Authenticity to Navy SEALs and Garfield's Star-Studded Cast,The Tonight Show Starring Jimmy Fallon,2024-05-24T04:14:37Z,136222,"Chris Pratt,Jimmy Fallon,Snoop Dogg",3
NQ6S1o80fNY,https://youtu.be/NQ6S1o80fNY,Jimmy Looks Back on 10 Years of Hosting The Tonight Show,The Tonight Show Starring Jimmy Fallon,2024-05-15T03:35:00Z,149644,"Bernie Sanders,Jimmy Fallon,Michael Cohen",3
hTMCbWWrmWU,https://youtu.be/hTMCbWWrmWU,"Trump Begs Biden to Debate Him ""Anytime, Anywhere, Anyplace"" with Weird Empty Podium",The Tonight Show Starring Jimmy Fallon,2024-04-04T03:35:00Z,294507,"Bernie Sanders,Elon Musk,Jimmy Fallon",3
ZyXTT8FhNt8,https://youtu.be/ZyXTT8FhNt8,Alicia Keys on Hell's Kitchen and Her Son's Obsession with Taylor Swift and Billie Eilish,The Tonight Show Starring Jimmy Fallon,2024-03-23T03:50:00Z,176391,"Billie Eilish,Jimmy Fallon,Taylor Swift",3
vHLijHSUKsI,https://youtu.be/vHLijHSUKsI,"Trump Grifts Donors to Pay Legal Fees, Mike Johnson’s Major Marjorie Taylor Greene Problem",The Tonight Show Starring Jimmy Fallon,2024-03-23T03:35:01Z,376031,"Jimmy Fallon,Marjorie Taylor Greene,Mike Johnson",3
Z8k7-HUQY9Y,https://youtu.be/Z8k7-HUQY9Y,Justin Timberlake Talks Getting Tackled by Travis Kelce and Sings a Classroom Instruments Mashup,The Tonight Show Starring Jimmy Fallon,2024-02-23T15:00:29Z,230465,"Jimmy Fallon,Justin Timberlake,Travis Kelce",3
600RzTL3mXA,https://youtu.be/600RzTL3mXA,"Jennifer Lopez Talks This Is Me...Now, Touring, Ben Affleck and Her Amazon Original Film (Extended)",The Tonight Show Starring Jimmy Fallon,2024-02-17T05:06:00Z,524461,"Ben Affleck,Jennifer Lopez,Jimmy Fallon",3
kqcVXLryYAs,https://youtu.be/kqcVXLryYAs,Amy Schumer Can't Compete with Beyoncé and Taylor Swift on Tour (Extended) | The Tonight Show,The Tonight Show Starring Jimmy Fallon,2024-02-14T04:58:00Z,380875,"Jennifer Aniston,Jimmy Fallon,Taylor Swift",3
2n0zFdQ_5No,https://youtu.be/2n0zFdQ_5No,Jalen Brunson on His Justin Bieber Game Day Ritual and Declining Michael Jordan's Signature,The Tonight Show Starring Jimmy Fallon,2024-02-10T05:06:00Z,382142,"Jimmy Fallon,Justin Bieber,Michael Jordan",3
0AMC7Xr3sZ4,https://youtu.be/0AMC7Xr3sZ4,"Taylor Swift Makes Grammy History, Tucker Carlson Spotted in Moscow | The Tonight Show",The Tonight Show Starring Jimmy Fallon,2024-02-06T04:42:00Z,305136,"Jimmy Fallon,Taylor Swift,Tucker Carlson",3
WJ9XdVJfUsU,https://youtu.be/WJ9XdVJfUsU,"Trump Claims He's More Popular Than Taylor Swift, Travis Kelce Inspires Haircuts Across Nation",The Tonight Show Starring Jimmy Fallon,2024-02-01T04:35:00Z,300453,"Jimmy Fallon,Taylor Swift,Travis Kelce",3
KWuNJDjJ48A,https://youtu.be/KWuNJDjJ48A,"Chiefs vs. 49ers (Taylor's Version), Trump Ordered to Pay $83 Million | The Tonight Show",The Tonight Show Starring Jimmy Fallon,2024-01-30T04:35:01Z,355730,"Barack Obama,Bill Clinton,Jimmy Fallon",3
DJ7_xmSRSRM,https://youtu.be/DJ7_xmSRSRM,"Trump Denies Being on Epstein's ""Stupid Island,"" DeSantis and Haley Face Off in Final Debate",The Tonight Show Starring Jimmy Fallon,2024-01-11T04:35:00Z,331892,"Alejandro Mayorkas,Jimmy Fallon,Nikki Haley",3
RpFsZszqlNQ,https://youtu.be/RpFsZszqlNQ,"Hunter Biden Indicted on Nine Tax Charges, Putin Announces Run for 2024 Re-Election",The Tonight Show Starring Jimmy Fallon,2023-12-09T05:05:27Z,202415,"Hunter Biden,Jimmy Fallon,Steven Spielberg",3
mwtdbOBnV5E,https://youtu.be/mwtdbOBnV5E,"Fourth Republican Presidential Debate Gets Heated, Christie Says Rivals Treat Trump Like Voldemort",The Tonight Show Starring Jimmy Fallon,2023-12-08T04:35:43Z,480650,"Eric Adams,Jill Biden,Jimmy Fallon",3
MPi0_AWunn4,https://youtu.be/MPi0_AWunn4,"Dua Lipa Reveals How She Wrote ""Dance The Night"" for Barbie and Dishes on Her Third Album (Extended)",The Tonight Show Starring Jimmy Fallon,2023-12-05T05:18:00Z,730474,"Dua Lipa,Jimmy Fallon,Tim Cook",3
wY_LB9MiukA,https://youtu.be/wY_LB9MiukA,"Impressions at the Desk with Ariana Grande, The Rock, Kevin Hart and More!",The Tonight Show Starring Jimmy Fallon,2023-11-28T15:00:52Z,1372199,"Ariana Grande,Arnold Schwarzenegger,Jimmy Fallon",3
Y8Asp0evDbo,https://youtu.be/Y8Asp0evDbo,Rachel Zegler on Her Love for Taylor Swift and Accidentally Starting a Rumor About Nicki Minaj,The Tonight Show Starring Jimmy Fallon,2023-11-16T05:00:18Z,156223,"Jimmy Fallon,Nicki Minaj,Taylor Swift",3
-J7RZaq9Dh0,https://youtu.be/-J7RZaq9Dh0,"Jimmy Addresses the End of SAG Strike, Nikki Haley Calls Vivek Ramaswamy ""Scum"" | The Tonight Show",The Tonight Show Starring Jimmy Fallon,2023-11-10T04:35:49Z,155936,"Jimmy Fallon,Nikki Haley,Vivek Ramaswamy",3
