video_id,url,title,channel_name,published_at,view_count,persons_found,total_persons
fbokINazA3E,https://youtu.be/fbokINazA3E,Alex Wagner Breaks Down the Results of the New Hampshire Primary for Trump and Haley,Late Night with Seth Meyers,2024-01-25T11:00:28Z,100214,"Donald Trump,Nikki Haley",2
ekwcr8JXMNc,https://youtu.be/ekwcr8JXMNc,"Even Fox News Admits New Hampshire Result Was Bad for Trump, Good for Biden: A Closer Look",Late Night with Seth Meyers,2024-01-25T02:00:18Z,1830409,"Donald Trump,Nikki Haley",2
N2iAwnT_vbk,https://youtu.be/N2iAwnT_vbk,DeSantis Campaign Ends in Humiliation; Confused Trump Blames Haley for Jan. 6: A Closer Look,Late Night with Seth Meyers,2024-01-23T02:00:07Z,1621670,"Donald Trump,Nikki Haley",2
0NNop7gKpQg,https://youtu.be/0NNop7gKpQg,"Rudy Hit with Stunning Defamation Verdict, Trump Embraces Fascist Rhetoric: A Closer Look",Late Night with Seth Meyers,2023-12-19T02:00:00Z,1579410,"Donald Trump,Rudy Giuliani",2
7hb106LBE20,https://youtu.be/7hb106LBE20,"Amber Says What: Taylor Swift Named TIME's Person of the Year, George Santos on Cameo",Late Night with Seth Meyers,2023-12-13T10:00:03Z,191117,"George Santos,Taylor Swift",2
gumWCQTr7lo,https://youtu.be/gumWCQTr7lo,"Trump Says He'll ""Redo"" 2020 Election, George Santos Flees Capitol in Shame: A Closer Look",Late Night with Seth Meyers,2023-12-05T02:00:25Z,1741600,"Donald Trump,George Santos",2
DRKuGucSXMk,https://youtu.be/DRKuGucSXMk,Erin Andrews Set Up Taylor Swift and Travis Kelce,Late Night with Seth Meyers,2023-10-17T10:00:10Z,514945,"Taylor Swift,Travis Kelce",2
cm74adJ3Ubg,https://youtu.be/cm74adJ3Ubg,Chris Hayes Dissects Matt Gaetz's Resolution to Remove Kevin McCarthy as House Speaker,Late Night with Seth Meyers,2023-10-04T11:00:26Z,370430,"Donald Trump,Matt Gaetz",2
xIh6kijMGUM,https://youtu.be/xIh6kijMGUM,"Boebert Humiliated Over ""Public Urination"" Fixation; Trump Wants to Bomb Mexico: A Closer Look",Late Night with Seth Meyers,2023-03-31T01:00:17Z,2920419,"Donald Trump,Marjorie Taylor Greene",2
IqezkOiFQJo,https://youtu.be/IqezkOiFQJo,Grand Jury Hears from Key Witness in Trump Case; Trump Rips DeSantis on Fox: A Closer Look,Late Night with Seth Meyers,2023-03-29T01:00:07Z,1511156,"Donald Trump,Stormy Daniels",2
-E21OifvfeU,https://youtu.be/-E21OifvfeU,Greene and Boebert Unravel at Twitter Hearing While Biden Gloats About SOTU: A Closer Look,Late Night with Seth Meyers,2023-02-10T02:00:00Z,2781580,"Hunter Biden,Marjorie Taylor Greene",2
202-XaS1ack,https://youtu.be/202-XaS1ack,"Trump Freaks Out over Criminal Probes, Calls Special Counsel ""a Terrorist"": A Closer Look",Late Night with Seth Meyers,2023-01-17T02:00:01Z,1664272,"Donald Trump,Joe Biden",2
9oUz_9nEOho,https://youtu.be/9oUz_9nEOho,"White House Press Secretary Karoline Leavitt Calls Qatari Jet Bribe a ""Donation"" to U.S. Air Force",Late Night with Seth Meyers,2025-05-16T09:00:22Z,293909,Karoline Leavitt,1
rjU5X0vSUhs,https://youtu.be/rjU5X0vSUhs,"Trump Attacks Biden's Foreign Policy, Claims It Created ""Havoc and Bedlam""",Late Night with Seth Meyers,2025-05-15T09:01:13Z,200880,Elon Musk,1
oDnICvbh5Z4,https://youtu.be/oDnICvbh5Z4,New Pope Criticized JD Vance; Conclave Upstages Trump's Underwhelming U.K. Trade Deal: A Closer Look,Late Night with Seth Meyers,2025-05-09T01:00:53Z,2248295,Donald Trump,1
a5r9ZA_e91Y,https://youtu.be/a5r9ZA_e91Y,Trump Orders Government to Reopen Alcatraz,Late Night with Seth Meyers,2025-05-08T09:00:01Z,194998,Elon Musk,1
wGo3YXu8vJw,https://youtu.be/wGo3YXu8vJw,"Trump's Rant About Dolls & Strollers Exposes MAGA's Hypocrisy on Economy, Health Care: A Closer Look",Late Night with Seth Meyers,2025-05-06T01:01:02Z,1818418,Donald Trump,1
2V4w-96Cnuo,https://youtu.be/2V4w-96Cnuo,"Trump Speaks with Jeff Bezos, Tries to Boost Birth Rates: Late Night's News of the Week",Late Night with Seth Meyers,2025-05-02T18:19:38Z,164494,Jeff Bezos,1
kjwieXpN7y0,https://youtu.be/kjwieXpN7y0,Blake Lively on the Highs and Lows of Her Year and Another Simple Favor,Late Night with Seth Meyers,2025-05-02T10:01:22Z,286596,Blake Lively,1
kaDrEd5ORoE,https://youtu.be/kaDrEd5ORoE,Trump Picks Himself to Be Pope,Late Night with Seth Meyers,2025-05-01T09:01:07Z,441290,Jeff Bezos,1
HgGK3nRE5uQ,https://youtu.be/HgGK3nRE5uQ,Trump Blames Biden for Shrinking Economy as Tariffs Cause Recession Fears: A Closer Look,Late Night with Seth Meyers,2025-05-01T01:00:17Z,2018356,Donald Trump,1
Ge7SpGlPdyU,https://youtu.be/Ge7SpGlPdyU,White House Considering Ideas to Boost the Country's Birth Rate,Late Night with Seth Meyers,2025-04-29T09:00:21Z,273318,Pope Francis,1
L32oebl5ftQ,https://youtu.be/L32oebl5ftQ,"Colin Jost Talks Pete Davidson and ""Titanic 2,"" Parenting with Scarlett Johansson and More",Late Night with Seth Meyers,2025-04-21T14:00:35Z,284654,George Santos,1
2Dth-LCJkt8,https://youtu.be/2Dth-LCJkt8,"Trump Brags About Tariffs, Says Countries Have Been ""Kissing His Ass""",Late Night with Seth Meyers,2025-04-10T09:00:04Z,217046,Elon Musk,1
hIuxTdYZDKk,https://youtu.be/hIuxTdYZDKk,Late Night White House Press Briefing: What Is Trump's Strategy for the Economy?,Late Night with Seth Meyers,2025-04-09T09:00:59Z,114192,Karoline Leavitt,1
KS2lLDb4blk,https://youtu.be/KS2lLDb4blk,Trump's Wall Street Allies Turn On Him Amid Stock Market Chaos; Protests Sweep Nation: A Closer Look,Late Night with Seth Meyers,2025-04-08T01:00:26Z,2332735,Donald Trump,1
Us_Uhp3PWbE,https://youtu.be/Us_Uhp3PWbE,Rachel Maddow Talks Elon Musk's Wisconsin Loss and the White House's Signal Chat Investigation,Late Night with Seth Meyers,2025-04-03T10:00:44Z,803164,Elon Musk,1
Ls2NCd6C9g0,https://youtu.be/Ls2NCd6C9g0,Trump Expects Elon Musk to Leave White House Role Soon,Late Night with Seth Meyers,2025-04-03T09:00:23Z,407997,Elon Musk,1
0mqOSYMq87M,https://youtu.be/0mqOSYMq87M,Musk and Trump Lose Big in Wisconsin After Spending Millions to Buy Votes: A Closer Look,Late Night with Seth Meyers,2025-04-03T01:00:01Z,2217919,Elon Musk,1
EHP9Q0FBL8A,https://youtu.be/EHP9Q0FBL8A,Elon Musk Urges People to Have Children During Wisconsin Supreme Court Election Rally,Late Night with Seth Meyers,2025-04-02T09:00:15Z,480949,Elon Musk,1
nU12bCBU-_Y,https://youtu.be/nU12bCBU-_Y,"Nathan Lane Had an Awkward Encounter with Kevin Costner, Helped Bill Burr Land His Broadway Role",Late Night with Seth Meyers,2025-04-01T10:01:04Z,133057,Kevin Costner,1
NzwHCNx8amM,https://youtu.be/NzwHCNx8amM,"Trump Plots Unconstitutional Third Term, Signal Scandal Grows, Musk Whines About Walz: A Closer Look",Late Night with Seth Meyers,2025-04-01T01:00:22Z,2732668,Elon Musk,1
Xo02kRbVDPQ,https://youtu.be/Xo02kRbVDPQ,"Trump's Tesla Stunt Flops as Stock Drops, Sales Plummet Amid Anti-Musk Protests: A Closer Look",Late Night with Seth Meyers,2025-03-14T01:00:32Z,3356091,Elon Musk,1
sSvdJoxuoRs,https://youtu.be/sSvdJoxuoRs,Parker Posey Talks Perfecting Her Accent for The White Lotus and Waiting 20 Years for the Role,Late Night with Seth Meyers,2025-03-13T10:01:15Z,986261,Steven Spielberg,1
Er0mPA31Nak,https://youtu.be/Er0mPA31Nak,Robert De Niro's Movie The Alto Knights Has Been in the Works Since the 1970s,Late Night with Seth Meyers,2025-03-12T10:00:14Z,149538,Robert De Niro,1
ZZdiFir_kNU,https://youtu.be/ZZdiFir_kNU,Trump Won't Rule Out Recession as Markets Plunge; Musk and Rubio Clash in White House: A Closer Look,Late Night with Seth Meyers,2025-03-11T01:00:23Z,2606304,Donald Trump,1
jMTDVJxrIas,https://youtu.be/jMTDVJxrIas,JD Vance Says Trump Wants to Complete Mexico's Border Wall,Late Night with Seth Meyers,2025-03-07T10:01:01Z,303143,Justin Trudeau,1
bvqppzDe--E,https://youtu.be/bvqppzDe--E,Trump's Lie-Filled Speech to Congress Interrupted by Rep. Al Green Over Medicaid Cuts: A Closer Look,Late Night with Seth Meyers,2025-03-06T02:00:23Z,1590808,Donald Trump,1
fq1Jb7IIxdI,https://youtu.be/fq1Jb7IIxdI,"Amber Says What: Beyoncé's Grammy Wins, Elon Musk’s Federal Employee Demands",Late Night with Seth Meyers,2025-03-05T10:00:47Z,114346,Elon Musk,1
ZIUcd_2bwao,https://youtu.be/ZIUcd_2bwao,Sen. Chris Murphy Regrets Voting for Secretary of State Marco Rubio,Late Night with Seth Meyers,2025-03-04T10:00:43Z,116389,Marco Rubio,1
-aIEzH2SJZ4,https://youtu.be/-aIEzH2SJZ4,"Trump Wants Canada as 51st State, Elon Musk’s Condom Claims: Late Night's News of the Week",Late Night with Seth Meyers,2025-02-14T18:45:55Z,285435,Elon Musk,1
yujj9E8MoA4,https://youtu.be/yujj9E8MoA4,Senate Confirms RFK Jr. as U.S. Health Secretary,Late Night with Seth Meyers,2025-02-14T10:01:12Z,231164,Elon Musk,1
fN3-u1_JoY0,https://youtu.be/fN3-u1_JoY0,Elon Musk Addresses False Claims About Sending $50 Million of Condoms to Gaza,Late Night with Seth Meyers,2025-02-13T10:00:47Z,333755,Elon Musk,1
4JGixMDhbNA,https://youtu.be/4JGixMDhbNA,Musk & Trump Grilled Over DOGE Cuts in Oval Office; MAGA's Greenland Name Change Bill: A Closer Look,Late Night with Seth Meyers,2025-02-13T02:00:05Z,1930388,Elon Musk,1
zv8finRBj1U,https://youtu.be/zv8finRBj1U,Trump Speaks at National Prayer Breakfast,Late Night with Seth Meyers,2025-02-07T10:01:08Z,240087,Elon Musk,1
VwxqkiK95-s,https://youtu.be/VwxqkiK95-s,"Musk’s Trump-Approved Takeover Sparks Backlash as Protests Erupt, Dems Demand Answers: A Closer Look",Late Night with Seth Meyers,2025-02-07T02:00:30Z,2394113,Elon Musk,1
Akvcky2Yv7U,https://youtu.be/Akvcky2Yv7U,Trump Agrees to Pause Tariffs on Mexico for One Month,Late Night with Seth Meyers,2025-02-05T02:00:06Z,783808,Karoline Leavitt,1
DWiFLdTSf2o,https://youtu.be/DWiFLdTSf2o,Trump Says Canada Wouldn't Exist Without the United States,Late Night with Seth Meyers,2025-02-04T10:00:10Z,499025,Elon Musk,1
3VLnpfc3CIA,https://youtu.be/3VLnpfc3CIA,Trump Caves in Tariff Fight with Canada and Mexico; Musk Takes Control of Government: A Closer Look,Late Night with Seth Meyers,2025-02-04T02:00:02Z,2784455,Donald Trump,1
uuSFWEWtOAs,https://youtu.be/uuSFWEWtOAs,JD Vance Claims Trump Has Already Accomplished More Than the Biden Administration,Late Night with Seth Meyers,2025-01-31T10:01:10Z,307550,Chuck Schumer,1
O9Ji9NA5i8A,https://youtu.be/O9Ji9NA5i8A,Governor Gretchen Whitmer Breaks Down How Trump's Tariffs Could Impact the Auto Industry,Late Night with Seth Meyers,2025-01-30T11:00:33Z,122388,Gretchen Whitmer,1
w-r7iFctXVI,https://youtu.be/w-r7iFctXVI,"Trump Causes ""Crisis"" with Denmark and Colombia, Illegally Purges Watchdogs: A Closer Look",Late Night with Seth Meyers,2025-01-28T02:00:41Z,1652398,Donald Trump,1
pnvqUkcAbiI,https://youtu.be/pnvqUkcAbiI,"CORRECTIONS Episode 127: Week of Monday, January 20",Late Night with Seth Meyers,2025-01-24T05:30:30Z,266379,Bernie Sanders,1
9euWE4f_JRE,https://youtu.be/9euWE4f_JRE,Trump Attends National Prayer Service at Washington National Cathedral,Late Night with Seth Meyers,2025-01-22T02:00:09Z,767990,Mike Johnson,1
u3YCFoTa3Yk,https://youtu.be/u3YCFoTa3Yk,Kamala Harris Plans to Write Tell-All Book,Late Night with Seth Meyers,2025-01-17T10:01:00Z,212588,Kamala Harris,1
g74Gxmts-fc,https://youtu.be/g74Gxmts-fc,"Amber Ruffin Calls Out Steve Bannon for Telling Elon Musk to ""Go Back to Africa""",Late Night with Seth Meyers,2025-01-16T10:30:20Z,271335,Elon Musk,1
6Q73BHG1Y6w,https://youtu.be/6Q73BHG1Y6w,President Biden Delivers Final Farewell Address,Late Night with Seth Meyers,2025-01-16T10:00:07Z,150541,Melania Trump,1
0ef4zETy_DU,https://youtu.be/0ef4zETy_DU,"Trump Nominee Pete Hegseth Faces Brutal Questions Over Drinking, Misconduct: A Closer Look",Late Night with Seth Meyers,2025-01-16T02:00:01Z,1644409,Pete Hegseth,1
BR8_vo-UNiA,https://youtu.be/BR8_vo-UNiA,Graham Norton Had to Cut Out One of Robert De Niro's Anecdotes,Late Night with Seth Meyers,2025-01-14T11:00:13Z,538570,Robert De Niro,1
Za0E2uPauwc,https://youtu.be/Za0E2uPauwc,"Trump Ally Steve Bannon Rips ""Evil"" Elon Musk as MAGA Civil War Erupts: A Closer Look",Late Night with Seth Meyers,2025-01-14T02:00:25Z,2114268,Elon Musk,1
mXrJdm86DMc,https://youtu.be/mXrJdm86DMc,"Sebastian Stan on Portraying Trump in The Apprentice, Jeremy Strong's Green Golden Globes Outfit",Late Night with Seth Meyers,2025-01-10T11:01:05Z,119750,Donald Trump,1
D21SLbz1HT0,https://youtu.be/D21SLbz1HT0,Sebastian Stan Talks Marvel's Thunderbolts* and Reveals How He Nailed His Trump Impersonation,Late Night with Seth Meyers,2025-01-10T11:00:26Z,165828,Donald Trump,1
gHCURuGDW_U,https://youtu.be/gHCURuGDW_U,Trump's White House Chief of Staff Susie Wiles Says She Won't Tolerate Drama,Late Night with Seth Meyers,2025-01-10T10:00:46Z,493750,Matt Gaetz,1
ZCVdKne7yVA,https://youtu.be/ZCVdKne7yVA,"Trump Gets Fact-Checked, Faces Backlash Over Lies About CA Wildfires: A Closer Look",Late Night with Seth Meyers,2025-01-10T02:00:18Z,2010605,Donald Trump,1
kXzFpaZW3Uk,https://youtu.be/kXzFpaZW3Uk,"Trump Wants to Turn the Gulf of Mexico into the ""Gulf of America""",Late Night with Seth Meyers,2025-01-09T10:00:46Z,164108,Matt Gaetz,1
Sppad60wSwQ,https://youtu.be/Sppad60wSwQ,Trump Speaks for Over an Hour at Mar-a-Lago Press Conference,Late Night with Seth Meyers,2025-01-08T10:00:26Z,171959,Rudy Giuliani,1
55pyJLyycYk,https://youtu.be/55pyJLyycYk,"Trump, Biden and Bernie React to Drone Hysteria, Mace Says It Could Be Aliens: A Closer Look",Late Night with Seth Meyers,2024-12-19T02:00:01Z,1410905,Elon Musk,1
fHIbhLNkSdo,https://youtu.be/fHIbhLNkSdo,Harris Dickinson Tried Really Hard Not to Fanboy Over Antonio Banderas on the Babygirl Set,Late Night with Seth Meyers,2024-12-18T12:00:56Z,281206,Nicole Kidman,1
xcSGyZG0Ssk,https://youtu.be/xcSGyZG0Ssk,"Trump Owes Election Win to Groceries, Bernie Sanders' Final Term: Late Night's News of the Week",Late Night with Seth Meyers,2024-12-14T00:37:13Z,120708,Bernie Sanders,1
jt9YHP7Lt9s,https://youtu.be/jt9YHP7Lt9s,Bernie Sanders Hints at Final Senate Term,Late Night with Seth Meyers,2024-12-12T10:00:44Z,422441,Bernie Sanders,1
Kl1HUUSWqqA,https://youtu.be/Kl1HUUSWqqA,House Republicans Block Release of Matt Gaetz's Ethics Report,Late Night with Seth Meyers,2024-12-11T02:00:09Z,843269,Matt Gaetz,1
yQANY5MegP8,https://youtu.be/yQANY5MegP8,"Paris Hilton and Nicole Richie Talk The Simple Life, Reuniting for The Encore and ""Sanasa"" Opera",Late Night with Seth Meyers,2024-12-10T12:01:16Z,249269,Paris Hilton,1
C_Uhcwtuo-Y,https://youtu.be/C_Uhcwtuo-Y,"Trump Appoints Border Czar Homan, Matt Gaetz Joins Cameo: Late Night's News of the Week",Late Night with Seth Meyers,2024-11-29T16:00:16Z,121883,Matt Gaetz,1
UNVGS0GKB4Y,https://youtu.be/UNVGS0GKB4Y,"Trump Team in ""Knife Fight,"" Aide Investigated; Rudy Giuliani Throws Tantrum in Court: A Closer Look",Late Night with Seth Meyers,2024-11-29T02:00:18Z,1399970,Rudy Giuliani,1
Z6Mee4ubBJA,https://youtu.be/Z6Mee4ubBJA,Jim Gaffigan Reveals the Scariest Part About Playing Tim Walz on SNL,Late Night with Seth Meyers,2024-11-26T11:00:38Z,143472,Tim Walz,1
G1B7Xrb4ZJI,https://youtu.be/G1B7Xrb4ZJI,Jim Gaffigan Talks Intense Comedy Set with Trump in the Audience and His Growing Whiskey Collection,Late Night with Seth Meyers,2024-11-26T11:00:24Z,192327,Tim Walz,1
ISFdVFBlcWc,https://youtu.be/ISFdVFBlcWc,Trump's Transition Team Criticized for Refusing to Disclose Donors,Late Night with Seth Meyers,2024-11-26T10:00:18Z,802221,Matt Gaetz,1
4aOEmORG1L0,https://youtu.be/4aOEmORG1L0,Elon Irks Trump World; Gaetz Won't Return to Congress; Shouting Matches at Mar-a-Lago: A Closer Look,Late Night with Seth Meyers,2024-11-26T02:00:03Z,1439126,Matt Gaetz,1
GsG238THvIo,https://youtu.be/GsG238THvIo,Matt Gaetz Withdraws as Trump's Attorney General Nominee,Late Night with Seth Meyers,2024-11-22T10:00:26Z,863299,Matt Gaetz,1
3duJsQWs02U,https://youtu.be/3duJsQWs02U,"Gaetz Out as More Damning Info Surfaces, Trump Cabinet Rocked by Scandal: A Closer Look",Late Night with Seth Meyers,2024-11-22T02:00:02Z,1468791,Matt Gaetz,1
rlykO3Yl2ns,https://youtu.be/rlykO3Yl2ns,Bridget Everett Was Saved by Ryan Reynolds and Kathy Najimy at Eric Gilliland's Memorial Service,Late Night with Seth Meyers,2024-11-21T12:01:00Z,110344,Ryan Reynolds,1
5FU6ljQgr9U,https://youtu.be/5FU6ljQgr9U,Jimmy O. Yang Was Asked to Moderate an Event with Kamala Harris During a Bachelor Party Trip,Late Night with Seth Meyers,2024-11-19T12:00:10Z,115489,Kamala Harris,1
v6ga1evRlow,https://youtu.be/v6ga1evRlow,Ariana Grande Told Kristin Chenoweth She Wanted to Play Glinda in Wicked When She Was 10,Late Night with Seth Meyers,2024-11-19T11:01:06Z,114703,Ariana Grande,1
8B3AQvqkf2U,https://youtu.be/8B3AQvqkf2U,Brett Goldstein on Trying a Corndog for the First Time and Working with Harrison Ford in Shrinking,Late Night with Seth Meyers,2024-11-15T12:00:10Z,309715,Harrison Ford,1
NkO17vnBMWQ,https://youtu.be/NkO17vnBMWQ,"Trump Cabinet ""Shocks"" Republicans, Gaetz Resigns Before ""Highly Damaging"" Report: A Closer Look",Late Night with Seth Meyers,2024-11-15T02:00:12Z,1596450,Matt Gaetz,1
fUENSHvMAPk,https://youtu.be/fUENSHvMAPk,Nikki Haley Says Election Results Should Be Democrats’ “Wake-Up Call”,Late Night with Seth Meyers,2024-11-13T02:00:32Z,742674,Nikki Haley,1
RJ13OoxKSCU,https://youtu.be/RJ13OoxKSCU,Biden To Host President-Elect Trump at White House,Late Night with Seth Meyers,2024-11-12T10:00:32Z,584065,Nikki Haley,1
33LftPXEYVI,https://youtu.be/33LftPXEYVI,Bernie Sanders Rips the Democratic Establishment; Trump Allies Claim Massive Mandate: A Closer Look,Late Night with Seth Meyers,2024-11-12T02:00:02Z,1514017,Bernie Sanders,1
qi11CWp38W4,https://youtu.be/qi11CWp38W4,Kamala Harris Delivers the First Concession Speech We Have Had in Eight Years,Late Night with Seth Meyers,2024-11-08T10:00:54Z,747366,Kamala Harris,1
IlB0Ko6gbKU,https://youtu.be/IlB0Ko6gbKU,Donald Trump Has Won the 2024 Election. Now What?: A Closer Look,Late Night with Seth Meyers,2024-11-07T02:00:20Z,2827038,Donald Trump,1
RHmyyiJgtc4,https://youtu.be/RHmyyiJgtc4,Seth Meyers Addresses the Outcome of the 2024 Presidential Election,Late Night with Seth Meyers,2024-11-06T23:48:22Z,1641081,Donald Trump,1
bQoF0pbAr8g,https://youtu.be/bQoF0pbAr8g,Keri Russell Couldn't Stop Sweating While Meeting Hillary Clinton,Late Night with Seth Meyers,2024-11-05T11:00:45Z,108260,Hillary Clinton,1
PoSl_Zy13eg,https://youtu.be/PoSl_Zy13eg,Trump Simulates Oral Sex on Microphone Ahead of 2024 Election,Late Night with Seth Meyers,2024-11-05T10:00:20Z,226183,Kamala Harris,1
7977j4dfBxk,https://youtu.be/7977j4dfBxk,"Trump's Dark, Weird & Desperate Closing Message: Lies, Threats & Complaints About SNL: A Closer Look",Late Night with Seth Meyers,2024-11-05T02:00:04Z,2524292,Donald Trump,1
FaKOG0tJdyk,https://youtu.be/FaKOG0tJdyk,Trump's Embarrassing Garbage Stunt Might Be His Most Surreal Photo Op Ever: A Closer Look,Late Night with Seth Meyers,2024-11-01T01:00:15Z,1923938,Donald Trump,1
GSZql17wcFk,https://youtu.be/GSZql17wcFk,Biden Calls Trump Supporters Garbage,Late Night with Seth Meyers,2024-10-31T09:00:17Z,635480,Kamala Harris,1
ba9J6va_ick,https://youtu.be/ba9J6va_ick,Seth truly can’t believe the “Donald Trump admires Hitler” story is just another piece of content.,Late Night with Seth Meyers,2024-10-31T03:49:16Z,261349,Donald Trump,1
_39aRY3EwT8,https://youtu.be/_39aRY3EwT8,"Nicolle Wallace on Trump's Madison Square Garden Rally, Election Fears and January 6 Insurrection",Late Night with Seth Meyers,2024-10-30T10:00:39Z,448135,Kamala Harris,1
3vMeKzuPJTw,https://youtu.be/3vMeKzuPJTw,NY Mayor Eric Adams Says Trump Is Not a Fascist,Late Night with Seth Meyers,2024-10-30T01:00:05Z,874058,Eric Adams,1
e0jh86S1j5I,https://youtu.be/e0jh86S1j5I,"Trump Is a Fascist Who Praised Hitler and Hitler’s Generals, John Kelly Says: A Closer Look",Late Night with Seth Meyers,2024-10-24T01:00:18Z,1831165,Donald Trump,1
REnENPjITjc,https://youtu.be/REnENPjITjc,Steve Martin and Martin Short Talk Filming Only Murders in the Building with Selena Gomez,Late Night with Seth Meyers,2024-10-22T10:00:31Z,194934,Selena Gomez,1
jn1GB3Dkr6o,https://youtu.be/jn1GB3Dkr6o,Trump Raves About Loving McDonald’s While Serving Fries,Late Night with Seth Meyers,2024-10-22T09:00:43Z,905567,Donald Trump,1
qJiFsUNXB04,https://youtu.be/qJiFsUNXB04,"Trump’s Weird Story About Arnold Palmer’s Penis Size, McDonald’s Stunt: A Closer Look",Late Night with Seth Meyers,2024-10-22T01:00:37Z,1904347,Donald Trump,1
8hmxYdYezQ8,https://youtu.be/8hmxYdYezQ8,Alice Paul Tapper Taught Her Dad Jake Tapper About Kamala Harris and Charli xcx's Brat Summer,Late Night with Seth Meyers,2024-10-11T11:00:09Z,240699,Kamala Harris,1
Re6_I2ca8m4,https://youtu.be/Re6_I2ca8m4,Trump Tells 11 Lies During Hugh Hewitt Interview,Late Night with Seth Meyers,2024-10-11T01:00:13Z,1868074,Tim Walz,1
OHMY2vVJKus,https://youtu.be/OHMY2vVJKus,Riley Keough on Finishing Lisa Marie Presley's Memoir and Listening to Her Old Voice Recordings,Late Night with Seth Meyers,2024-10-10T10:00:24Z,172415,Lisa Marie,1
7e2JffRi01M,https://youtu.be/7e2JffRi01M,New York Jets Fire Head Coach Robert Saleh,Late Night with Seth Meyers,2024-10-10T09:00:06Z,587268,Kamala Harris,1
WGuRmNZsrhI,https://youtu.be/WGuRmNZsrhI,"Amber Says What: P. Diddy, Republicans Endorsing Kamala Harris",Late Night with Seth Meyers,2024-10-09T09:00:25Z,204773,Kamala Harris,1
4lbgnWP-zw8,https://youtu.be/4lbgnWP-zw8,Why People Leave Trump's Rallies Early; Elon Musk Campaigns with Trump: A Closer Look,Late Night with Seth Meyers,2024-10-08T01:00:05Z,2060554,Elon Musk,1
iLW-3i2Upm8,https://youtu.be/iLW-3i2Upm8,Trump Hit with Bombshell by Jack Smith Revealing Damning New Coup Evidence: A Closer Look,Late Night with Seth Meyers,2024-10-04T01:00:32Z,1875679,Donald Trump,1
PWiCdkbiMVg,https://youtu.be/PWiCdkbiMVg,JD Vance Whines About Fact-Checking at VP Debate,Late Night with Seth Meyers,2024-10-03T09:00:23Z,1076411,Tim Walz,1
Fo-PK0edyS8,https://youtu.be/Fo-PK0edyS8,"Mark Robinson's Scandal, Eric Adams Indicted: Late Night's News of the Week",Late Night with Seth Meyers,2024-09-27T17:33:32Z,109533,Eric Adams,1
8ZMWq0jeDGw,https://youtu.be/8ZMWq0jeDGw,Trump's Weird Obsession with Kamala Harris and McDonald's Escalates,Late Night with Seth Meyers,2024-09-26T09:00:06Z,1252352,Kamala Harris,1
felVymA29FY,https://youtu.be/felVymA29FY,Michael Bublé's 6-Year-Old Daughter Is Snoop Dogg's Biggest Fan,Late Night with Seth Meyers,2024-09-24T10:00:42Z,377833,Snoop Dogg,1
4Cc28IQXUBE,https://youtu.be/4Cc28IQXUBE,"Trump and Vance Reel Amid Mark Robinson Scandal, Trump Refuses to Debate Harris Again: A Closer Look",Late Night with Seth Meyers,2024-09-24T01:00:04Z,2209116,Donald Trump,1
iGFmV9mRn5A,https://youtu.be/iGFmV9mRn5A,"Obama's and Clinton's Kamala Fundraisers, Trump Hates Taylor Swift: Late Night's News of the Week",Late Night with Seth Meyers,2024-09-20T18:03:44Z,145508,Taylor Swift,1
8ZelvsUQ9HQ,https://youtu.be/8ZelvsUQ9HQ,"CORRECTIONS Episode 113: Week of Monday, September 16",Late Night with Seth Meyers,2024-09-20T04:30:05Z,307368,Harrison Ford,1
MbYojL1zcH8,https://youtu.be/MbYojL1zcH8,"Fox Cuts Away from Trump's NY Rally, Vance Gets Fact-Checked on Pet Eating Lies: A Closer Look",Late Night with Seth Meyers,2024-09-20T01:00:10Z,3086323,Donald Trump,1
VGgghqAFHJI,https://youtu.be/VGgghqAFHJI,Trump & Vance Double Down on Lies About Pet Eating; GOP Blames Dems for Quoting Trump: A Closer Look,Late Night with Seth Meyers,2024-09-18T01:00:26Z,2204354,Donald Trump,1
7vAdeB63eKU,https://youtu.be/7vAdeB63eKU,"Republicans Admit Trump Lost Debate to Harris, Trump Whines About Fact Checking: A Closer Look",Late Night with Seth Meyers,2024-09-13T01:00:07Z,2529081,Kamala Harris,1
skBzzyiE98s,https://youtu.be/skBzzyiE98s,Trump Gets Last Words in Presidential Debate Against Kamala Harris,Late Night with Seth Meyers,2024-09-12T09:00:47Z,630716,Kamala Harris,1
3YDItbyq0vc,https://youtu.be/3YDItbyq0vc,"Tim Walz Mocks JD Vance's Embarrassing Donut Disaster, Trump Insists He's ""Not Weird"": A Closer Look",Late Night with Seth Meyers,2024-09-06T01:00:02Z,2224210,Tim Walz,1
kEwqEi7wx-0,https://youtu.be/kEwqEi7wx-0,Kamala Harris Unveils Economic Proposal Focusing on Small Businesses,Late Night with Seth Meyers,2024-09-05T09:00:46Z,775600,Kamala Harris,1
q8hkIZsuCQ8,https://youtu.be/q8hkIZsuCQ8,Chris Hayes Breaks Down Trump's Struggle to Run Against Kamala Harris,Late Night with Seth Meyers,2024-09-04T10:00:50Z,309418,Kamala Harris,1
Ge0BXLfiAXk,https://youtu.be/Ge0BXLfiAXk,"""It's Unlike Anything I Have Ever Covered in My Career"" - Chris Hayes on the 2024 Election Cycle",Late Night with Seth Meyers,2024-09-04T10:00:14Z,234960,Kamala Harris,1
qVlpMfL8OPA,https://youtu.be/qVlpMfL8OPA,"Kamala Harris' Wedding Anniversary, Mike Lindell Undercover at DNC: Late Night's News of the Week",Late Night with Seth Meyers,2024-08-23T16:54:36Z,358089,Kamala Harris,1
YRdGDB9K08w,https://youtu.be/YRdGDB9K08w,"Mike Lindell Humiliated by 12-Year-Old at DNC; Trump Whines About Obama ""Size"" Jab: A Closer Look",Late Night with Seth Meyers,2024-08-23T01:00:13Z,3876125,Kamala Harris,1
pTirYSFQH2Y,https://youtu.be/pTirYSFQH2Y,Trump and Elon Musk “sound like eighth graders watching skateboard fails on YouTube.” #acloserlook,Late Night with Seth Meyers,2024-08-20T22:00:37Z,283841,Elon Musk,1
hJv2b-X7zxo,https://youtu.be/hJv2b-X7zxo,"Trump Slammed for Medal of Honor Comments, Says He’s “Better Looking” Than Kamala: A Closer Look",Late Night with Seth Meyers,2024-08-20T01:00:20Z,2797303,Donald Trump,1
7RU7DOt2MoQ,https://youtu.be/7RU7DOt2MoQ,"President Biden Claims United States Has ""Beat Inflation""",Late Night with Seth Meyers,2024-08-16T09:00:05Z,214823,Kamala Harris,1
bFwJOo99yyc,https://youtu.be/bFwJOo99yyc,Rattled Trump Blames Technology for Disastrous X Livestream with Elon Musk: A Closer Look,Late Night with Seth Meyers,2024-08-15T01:00:21Z,2482322,Elon Musk,1
b4b9Ong-URI,https://youtu.be/b4b9Ong-URI,Trump Made At Least 20 False Claims in X Interview with Elon Musk,Late Night with Seth Meyers,2024-08-14T01:00:19Z,2059656,Elon Musk,1
