video_id,url,title,channel_name,published_at,view_count,persons_found,total_persons
Nck0o_xtqko,https://youtu.be/Nck0o_xtqko,Carmelo Anthony Talks Viral Dwyane Wade Statue & Watching LeBron James and Steph Curry Win in Paris,The Tonight Show Starring Jimmy Fallon,2024-11-08T04:58:00Z,191120,Jimmy Fallon,1
xj6C38929vU,https://youtu.be/xj6C38929vU,"Saoirse Ronan Was Told by Chappell Roan They Are ""Twins,"" Talks Getting Married and Blitz (Extended)",The Tonight Show Starring Jimmy Fallon,2024-11-08T04:50:00Z,255460,Jimmy Fallon,1
kiAfya_VJus,https://youtu.be/kiAfya_VJus,Putin Celebrates Trump's Election Victory While Biden Consoles America | The Tonight Show,The Tonight Show Starring Jimmy Fallon,2024-11-08T04:35:29Z,279690,Jimmy Fallon,1
NmZ1x3JZtLc,https://youtu.be/NmZ1x3JZtLc,"Kevin Kline Got Booed by a Stadium Full of People, Talks Jimmy Crashing His Family Dinner (Extended)",The Tonight Show Starring Jimmy Fallon,2024-11-05T04:50:00Z,239242,Jimmy Fallon,1
V49R7Pl39qA,https://youtu.be/V49R7Pl39qA,"Tom Holland on Spider-Man 4 & Timothée Chalamet Calling Him a Rizz Master, Plays 5-Second Summaries",The Tonight Show Starring Jimmy Fallon,2024-11-02T13:00:37Z,379210,Jimmy Fallon,1
InnkRKfLt-E,https://youtu.be/InnkRKfLt-E,Shin Lim Performs a Mind-Blowing Optical Card Trick for Jimmy and The Roots (Extended),The Tonight Show Starring Jimmy Fallon,2024-11-01T04:30:10Z,2261736,Jimmy Fallon,1
7icVxHC_t8E,https://youtu.be/7icVxHC_t8E,Sarah Sherman Discusses the Viral Domingo SNL Sketch and Reads Her Spookiest Halloween Stories,The Tonight Show Starring Jimmy Fallon,2024-11-01T03:58:00Z,234514,Jimmy Fallon,1
0_kmXp8_huI,https://youtu.be/0_kmXp8_huI,Andrea Bocelli: Canto della Terra ft. Lauren Daigle | The Tonight Show Starring Jimmy Fallon,The Tonight Show Starring Jimmy Fallon,2024-10-30T04:32:00Z,203492,Jimmy Fallon,1
RmQJJK61FOQ,https://youtu.be/RmQJJK61FOQ,Keri Russell and Allison Janney Did the Floss Between Filming Scenes for The Diplomat (Extended),The Tonight Show Starring Jimmy Fallon,2024-10-30T03:58:00Z,167723,Jimmy Fallon,1
99DAJKDleSE,https://youtu.be/99DAJKDleSE,"Trump Calls Racist MSG Rally an ""Absolute Love Fest"" with One Week Left Until 2024 Election",The Tonight Show Starring Jimmy Fallon,2024-10-30T03:35:00Z,287681,Jimmy Fallon,1
KyzMTZl5Ix8,https://youtu.be/KyzMTZl5Ix8,Sevdaliza: Alibi ft. Yseult | The Tonight Show Starring Jimmy Fallon,The Tonight Show Starring Jimmy Fallon,2024-10-29T04:32:00Z,916193,Jimmy Fallon,1
9Pl6Dg0YB3w,https://youtu.be/9Pl6Dg0YB3w,"A.J. & Big Justice and The Rizzler Give a Rizz Face Tutorial, Rank Halloween Candy on The Boom Meter",The Tonight Show Starring Jimmy Fallon,2024-10-29T04:06:00Z,1214324,Jimmy Fallon,1
r2eHvfXtmR4,https://youtu.be/r2eHvfXtmR4,"Reba McEntire Reacts to ""I'm a Survivor"" Going Viral on TikTok, Talks Starring in Happy's Place",The Tonight Show Starring Jimmy Fallon,2024-10-29T03:42:00Z,212293,Jimmy Fallon,1
mGonxK0z_M8,https://youtu.be/mGonxK0z_M8,"Trump Has Unhinged, Racist Rally at Madison Square Garden, Shares Awkward Kiss with Melania",The Tonight Show Starring Jimmy Fallon,2024-10-29T03:35:01Z,456469,Jimmy Fallon,1
jjbOJcHirJM,https://youtu.be/jjbOJcHirJM,Damiano David: Born With A Broken Heart | The Tonight Show Starring Jimmy Fallon,The Tonight Show Starring Jimmy Fallon,2024-10-28T18:00:29Z,2149498,Jimmy Fallon,1
yj4LZA-ty_w,https://youtu.be/yj4LZA-ty_w,The Voidz: Square Wave | The Tonight Show Starring Jimmy Fallon,The Tonight Show Starring Jimmy Fallon,2024-10-24T04:35:02Z,297467,Jimmy Fallon,1
DBV_bQiSpck,https://youtu.be/DBV_bQiSpck,The Voidz: 7 Horses | The Tonight Show Starring Jimmy Fallon,The Tonight Show Starring Jimmy Fallon,2024-10-24T04:32:00Z,220996,Jimmy Fallon,1
Z8BmhdyFG7E,https://youtu.be/Z8BmhdyFG7E,"Julian Casablancas on Jimmy Opening for the Strokes, His Charli xcx Collab and The Voidz Album",The Tonight Show Starring Jimmy Fallon,2024-10-24T04:06:00Z,572437,Jimmy Fallon,1
1nSydA5hzdU,https://youtu.be/1nSydA5hzdU,"Megan Thee Stallion Reviews Sex and the City Characters, Talks New Album & In Her Words Documentary",The Tonight Show Starring Jimmy Fallon,2024-10-24T03:47:41Z,356755,Jimmy Fallon,1
OgxGa8ei3sM,https://youtu.be/OgxGa8ei3sM,Damiano David: Silverlines | The Tonight Show Starring Jimmy Fallon,The Tonight Show Starring Jimmy Fallon,2024-10-23T04:32:00Z,728661,Jimmy Fallon,1
wGywhE5D6fA,https://youtu.be/wGywhE5D6fA,"Jimmy Challenges Tom Holland to Recap Back to the Future, Fight Club and More in 5-Second Summaries",The Tonight Show Starring Jimmy Fallon,2024-10-23T03:50:00Z,307878,Jimmy Fallon,1
_5CTg5asoC0,https://youtu.be/_5CTg5asoC0,"Tom Holland Confirms Spider-Man 4, Talks Hiding Tobey Maguire and Andrew Garfield Cameos and BERO",The Tonight Show Starring Jimmy Fallon,2024-10-23T03:42:00Z,3251685,Jimmy Fallon,1
yDMggL_bBo4,https://youtu.be/yDMggL_bBo4,Rhett & Link's Most Viral Moments on the Tonight Show,The Tonight Show Starring Jimmy Fallon,2024-10-17T13:01:14Z,268060,Jimmy Fallon,1
lqT-WEaXnRo,https://youtu.be/lqT-WEaXnRo,Colin Farrell and Cristin Milioti Talk Colin's Unrecognizable Transformation for The Penguin,The Tonight Show Starring Jimmy Fallon,2024-10-13T13:01:01Z,1089943,Jimmy Fallon,1
9rqyMEcorrE,https://youtu.be/9rqyMEcorrE,Stevie Nicks Talks Solo Career Journey and Answers Viewer Questions | (Late Night with Jimmy Fallon),The Tonight Show Starring Jimmy Fallon,2024-10-11T18:11:40Z,389470,Jimmy Fallon,1
tVhotIkq1-Y,https://youtu.be/tVhotIkq1-Y,Madelyn Cline Had a Rat Dropped on Her Head While Filming Outer Banks (Extended) | The Tonight Show,The Tonight Show Starring Jimmy Fallon,2024-10-11T04:17:00Z,375937,Jimmy Fallon,1
PBGPbOgwtIA,https://youtu.be/PBGPbOgwtIA,Jordan Peele Blind Ranks Horror Films and Shares His Childhood Halloween Costumes (Extended),The Tonight Show Starring Jimmy Fallon,2024-10-11T03:52:00Z,233999,Jimmy Fallon,1
pTSskajkC7s,https://youtu.be/pTSskajkC7s,FINNEAS: Lotus Eater | The Tonight Show Starring Jimmy Fallon,The Tonight Show Starring Jimmy Fallon,2024-10-10T04:27:23Z,131951,Jimmy Fallon,1
C7LJd-OH-io,https://youtu.be/C7LJd-OH-io,Rachel Sennott Got Arrested in the Cayman Islands (Extended) | The Tonight Show,The Tonight Show Starring Jimmy Fallon,2024-10-10T03:57:07Z,159660,Jimmy Fallon,1
zWxikIv-Jys,https://youtu.be/zWxikIv-Jys,Pharrell Williams and The Roots Create a Song Piece by Piece (Extended) | The Tonight Show,The Tonight Show Starring Jimmy Fallon,2024-10-10T03:42:00Z,464607,Jimmy Fallon,1
7pb5SA0A3pA,https://youtu.be/7pb5SA0A3pA,"Chris Pine Reacts to The Princess Diaries 3 Announcement, Recites ""Espresso"" In Italian (Extended)",The Tonight Show Starring Jimmy Fallon,2024-10-09T03:42:00Z,229610,Jimmy Fallon,1
mMl0Y4dMJCk,https://youtu.be/mMl0Y4dMJCk,Hoda Kotb Talks About Her Decision to Leave TODAY Show and 26 Years at NBC | The Tonight Show,The Tonight Show Starring Jimmy Fallon,2024-10-08T03:50:00Z,123987,Jimmy Fallon,1
4sDwMuYFA40,https://youtu.be/4sDwMuYFA40,Chris Martin on Performing with Michael J. Fox and Coldplay's Moon Music Being Made from Trash,The Tonight Show Starring Jimmy Fallon,2024-10-04T04:36:58Z,358660,Jimmy Fallon,1
tT_H9T_XUJQ,https://youtu.be/tT_H9T_XUJQ,Teddy Swims: The Door | The Tonight Show Starring Jimmy Fallon,The Tonight Show Starring Jimmy Fallon,2024-10-02T04:32:00Z,2142340,Jimmy Fallon,1
rlPUvRM5Kio,https://youtu.be/rlPUvRM5Kio,Jelly Roll & mgk & Travis Barker: Lonely Road | The Tonight Show Starring Jimmy Fallon,The Tonight Show Starring Jimmy Fallon,2024-10-01T04:32:00Z,832052,Jimmy Fallon,1
h9tTeL7N9gY,https://youtu.be/h9tTeL7N9gY,"Jelly Roll on Life After Prison, Beautifully Broken Album & Breaking His First CMA Award (Extended)",The Tonight Show Starring Jimmy Fallon,2024-10-01T04:14:00Z,226795,Jimmy Fallon,1
9tAsLOyWbNw,https://youtu.be/9tAsLOyWbNw,Kate McKinnon on Spending 12 Years on Her Debut Novel and Running a Resort for Geese (Extended),The Tonight Show Starring Jimmy Fallon,2024-10-01T03:58:00Z,126080,Jimmy Fallon,1
8fJxdFRBP20,https://youtu.be/8fJxdFRBP20,Cate Blanchett on Hypnotizing Her Chickens and Standing Ovation Contests at Film Festivals,The Tonight Show Starring Jimmy Fallon,2024-09-27T03:58:00Z,143427,Jimmy Fallon,1
CDJytIkiNlc,https://youtu.be/CDJytIkiNlc,"Prince Harry Visits Jimmy Fallon's New Haunted Maze Experience ""Tonightmares"" | The Tonight Show",The Tonight Show Starring Jimmy Fallon,2024-09-27T03:45:00Z,231255,Jimmy Fallon,1
Ii4ubl3URhc,https://youtu.be/Ii4ubl3URhc,MJ Lenderman: Wristwatch | The Tonight Show Starring Jimmy Fallon,The Tonight Show Starring Jimmy Fallon,2024-09-26T04:32:00Z,317176,Jimmy Fallon,1
uW8Wr-8erP8,https://youtu.be/uW8Wr-8erP8,"Chloë Sevigny Talks Cameo in Charli xcx's ""360"" Video and Netflix's Monsters (Extended)",The Tonight Show Starring Jimmy Fallon,2024-09-26T03:58:00Z,144043,Jimmy Fallon,1
8h7ivw_37CM,https://youtu.be/8h7ivw_37CM,"Trump Campaigns Amongst Plumbing Pipes, Agrees to Spanish-Speaking Univision Town Hall",The Tonight Show Starring Jimmy Fallon,2024-09-26T03:35:00Z,375144,Jimmy Fallon,1
KjxjIM7LIDo,https://youtu.be/KjxjIM7LIDo,Margaret Qualley Says Husband Jack Antonoff Lied to Adam Sandler for Her Happy Gilmore 2 Role,The Tonight Show Starring Jimmy Fallon,2024-09-25T04:06:00Z,514250,Jimmy Fallon,1
-Joci-EOYjE,https://youtu.be/-Joci-EOYjE,Jimmy Gets Interrupted by a Massive Birthday Flash Mob Surprise | The Tonight Show,The Tonight Show Starring Jimmy Fallon,2024-09-20T21:22:05Z,101301,Jimmy Fallon,1
nNIsM5QQDbQ,https://youtu.be/nNIsM5QQDbQ,Twenty One Pilots: Routines in the Night | The Tonight Show Starring Jimmy Fallon,The Tonight Show Starring Jimmy Fallon,2024-09-20T04:32:00Z,934233,Jimmy Fallon,1
CLAXa1CW7xU,https://youtu.be/CLAXa1CW7xU,Demi Lovato Reveals the Traumatic Reality of Being a Child Star (Extended) | The Tonight Show,The Tonight Show Starring Jimmy Fallon,2024-09-20T03:58:00Z,480770,Jimmy Fallon,1
nqIJ1zkdStE,https://youtu.be/nqIJ1zkdStE,"Trump Uses Bitcoin to Buy Burgers in NYC, Russia Urges Citizens to Make Babies During Work Breaks",The Tonight Show Starring Jimmy Fallon,2024-09-20T03:36:19Z,314898,Jimmy Fallon,1
RW0PxJORWZg,https://youtu.be/RW0PxJORWZg,"""30 Seconds to…"" with Eva Mendes | The Tonight Show Starring Jimmy Fallon",The Tonight Show Starring Jimmy Fallon,2024-09-19T03:58:00Z,163109,Jimmy Fallon,1
WiD6KjygMSs,https://youtu.be/WiD6KjygMSs,Linkin Park: The Emptiness Machine | The Tonight Show Starring Jimmy Fallon,The Tonight Show Starring Jimmy Fallon,2024-09-18T04:32:00Z,6235010,Jimmy Fallon,1
n5Jo90PYoCM,https://youtu.be/n5Jo90PYoCM,"Trump Threatens Lawsuit to Challenge Mail-in Ballots, 8-Year-Old Girl Drives Herself to Target",The Tonight Show Starring Jimmy Fallon,2024-09-18T03:39:16Z,350127,Jimmy Fallon,1
uSi1pjb5TQg,https://youtu.be/uSi1pjb5TQg,Yseult: SUICIDE | The Tonight Show Starring Jimmy Fallon,The Tonight Show Starring Jimmy Fallon,2024-09-17T04:32:00Z,304446,Jimmy Fallon,1
SVigee1lrXI,https://youtu.be/SVigee1lrXI,Meghann Fahy Accidentally Kicked Jennifer Coolidge in the Face While Filming The White Lotus,The Tonight Show Starring Jimmy Fallon,2024-09-17T04:02:00Z,120060,Jimmy Fallon,1
Vl8kjJw_-zY,https://youtu.be/Vl8kjJw_-zY,"JD Vance Admits He Made Up Pet-Eating Immigrant Story, TikTok Argues Against Ban in Federal Court",The Tonight Show Starring Jimmy Fallon,2024-09-17T03:35:13Z,1144044,Jimmy Fallon,1
-VMcGRpbA7E,https://youtu.be/-VMcGRpbA7E,Cristin Milioti on Her Failed Wicked Audition and The Penguin with Colin Farrell | The Tonight Show,The Tonight Show Starring Jimmy Fallon,2024-09-13T04:20:00Z,295841,Jimmy Fallon,1
1HhCoN0OWmE,https://youtu.be/1HhCoN0OWmE,Jayson Tatum on His Championship-Filled Summer and Manifesting His NBA and Olympic Dreams (Extended),The Tonight Show Starring Jimmy Fallon,2024-09-12T04:24:00Z,152584,Jimmy Fallon,1
EfObYY2t-DU,https://youtu.be/EfObYY2t-DU,Kathryn Hahn Talks WandaVision and Agatha All Along with Aubrey Plaza and Patti LuPone (Extended),The Tonight Show Starring Jimmy Fallon,2024-09-12T04:10:00Z,404912,Jimmy Fallon,1
1bOHPNxwvFU,https://youtu.be/1bOHPNxwvFU,Lainey Wilson: 4x4xU | The Tonight Show Starring Jimmy Fallon,The Tonight Show Starring Jimmy Fallon,2024-09-11T04:33:52Z,198450,Jimmy Fallon,1
dKN-4E0T-V4,https://youtu.be/dKN-4E0T-V4,St. Vincent: Flea | The Tonight Show Starring Jimmy Fallon,The Tonight Show Starring Jimmy Fallon,2024-09-10T04:32:00Z,187169,Jimmy Fallon,1
Ro9zMw47iFM,https://youtu.be/Ro9zMw47iFM,"Eve Hewson on Her Brat Summer, Not Wanting to Meet Charli xcx and The Perfect Couple (Extended)",The Tonight Show Starring Jimmy Fallon,2024-09-10T04:18:00Z,192888,Jimmy Fallon,1
-Na8aMWlDy0,https://youtu.be/-Na8aMWlDy0,"Demi Moore Talks Variety's Demi-ssance, Her Dog's Vogue Cover and The Substance (Extended)",The Tonight Show Starring Jimmy Fallon,2024-09-10T04:10:00Z,277710,Jimmy Fallon,1
yLbvz3FfXiM,https://youtu.be/yLbvz3FfXiM,Colin Jost and Michael Che Crash Jimmy's Monologue to Tell Jokes About Summer News | Tonight Show,The Tonight Show Starring Jimmy Fallon,2024-09-10T03:47:26Z,370363,Jimmy Fallon,1
1xEOI3lhYLM,https://youtu.be/1xEOI3lhYLM,Facebreakers with Kevin Hart | The Tonight Show Starring Jimmy Fallon,The Tonight Show Starring Jimmy Fallon,2024-09-06T05:32:30Z,103627,Jimmy Fallon,1
8mxAu6VDlzc,https://youtu.be/8mxAu6VDlzc,"Kevin Hart Says Jimmy's Song About Him Upset His Son, Talks Fight Night and Viral US Open Video",The Tonight Show Starring Jimmy Fallon,2024-09-06T05:14:00Z,891373,Jimmy Fallon,1
4Xni3BfE3f0,https://youtu.be/4Xni3BfE3f0,"Trump Fails with Gen Z, Town Hall Moderated by Fox Ally Sean Hannity | The Tonight Show",The Tonight Show Starring Jimmy Fallon,2024-09-05T03:35:00Z,287936,Jimmy Fallon,1
WnZzfgvWuJI,https://youtu.be/WnZzfgvWuJI,"Taraji P. Henson Caught Cute Simone Biles Moment on Video, Talks Fight Night (Extended)",The Tonight Show Starring Jimmy Fallon,2024-09-04T03:58:00Z,168503,Jimmy Fallon,1
SJ3wy5c80jc,https://youtu.be/SJ3wy5c80jc,Dating App Duets with Taraji P. Henson | The Tonight Show Starring Jimmy Fallon,The Tonight Show Starring Jimmy Fallon,2024-09-04T03:50:00Z,126605,Jimmy Fallon,1
4ggh1vndo9E,https://youtu.be/4ggh1vndo9E,Scarlett Johansson Talks Reading Lines with Colin Jost and Plays the Whisper Challenge,The Tonight Show Starring Jimmy Fallon,2024-08-27T13:00:05Z,177774,Jimmy Fallon,1
IzepJ_P-NpM,https://youtu.be/IzepJ_P-NpM,Eddie Murphy Reflects on His Iconic James Brown SNL Sketch | (Late Night with Jimmy Fallon),The Tonight Show Starring Jimmy Fallon,2024-08-25T13:00:30Z,1236818,Jimmy Fallon,1
4j2lkfEET-0,https://youtu.be/4j2lkfEET-0,"Jenna Ortega Got Scared by Michael Keaton Dressed Up as Beetlejuice, Talks Wednesday Season 2",The Tonight Show Starring Jimmy Fallon,2024-08-22T04:44:00Z,1962027,Jimmy Fallon,1
T5ZfLJCP6EQ,https://youtu.be/T5ZfLJCP6EQ,True Confessions with Jenna Ortega and Catherine O'Hara | The Tonight Show Starring Jimmy Fallon,The Tonight Show Starring Jimmy Fallon,2024-08-22T04:38:00Z,485902,Jimmy Fallon,1
EHIMF2F26WU,https://youtu.be/EHIMF2F26WU,Rapsody: 3:AM/Green Eyes ft. Erykah Badu | The Tonight Show Starring Jimmy Fallon,The Tonight Show Starring Jimmy Fallon,2024-08-20T05:55:00Z,262863,Jimmy Fallon,1
qQkduSGM2Yw,https://youtu.be/qQkduSGM2Yw,Taylor Tomlinson Talks Save Me Comedy Tour and Gets Jimmy to Sign a Fever Pitch DVD | Tonight Show,The Tonight Show Starring Jimmy Fallon,2024-08-20T05:35:02Z,371390,Jimmy Fallon,1
GOmOMhqhxdU,https://youtu.be/GOmOMhqhxdU,Michael Keaton on Getting Recognized as Batman and His Beetlejuice Beetlejuice Deal with Tim Burton,The Tonight Show Starring Jimmy Fallon,2024-08-20T05:28:00Z,257400,Jimmy Fallon,1
2Q0_bY1lVr0,https://youtu.be/2Q0_bY1lVr0,Michael Keaton on Creating Tim Burton's Beetlejuice and Knox Goes Away with Al Pacino | Tonight Show,The Tonight Show Starring Jimmy Fallon,2024-08-20T05:20:00Z,178677,Jimmy Fallon,1
nz_1EEPt8BY,https://youtu.be/nz_1EEPt8BY,"Democratic National Convention Kicks Off in Chicago, Biden Delivers Opening Speech | Tonight Show",The Tonight Show Starring Jimmy Fallon,2024-08-20T05:06:19Z,272393,Jimmy Fallon,1
ng-jFUzppEA,https://youtu.be/ng-jFUzppEA,Ravyn Lenae: Genius/Love Me Not | The Tonight Show Starring Jimmy Fallon,The Tonight Show Starring Jimmy Fallon,2024-08-16T04:32:00Z,117887,Jimmy Fallon,1
OHuLOl_NylY,https://youtu.be/OHuLOl_NylY,Ben Schwartz Mistakes The Tonight Show for SNL; Talks Ben Schwartz & Friends (Extended),The Tonight Show Starring Jimmy Fallon,2024-08-16T04:12:00Z,168122,Jimmy Fallon,1
oGz29N_UKtE,https://youtu.be/oGz29N_UKtE,Halle Berry on 20 Years of Catwoman and Getting Mark Wahlberg to Do His Own Stunts in The Union,The Tonight Show Starring Jimmy Fallon,2024-08-16T04:04:00Z,202559,Jimmy Fallon,1
oC2XcWjeJjs,https://youtu.be/oC2XcWjeJjs,Charlie Vickers Didn't Know About Major The Rings of Power Twist; Teaches Jimmy Elvish Phrases,The Tonight Show Starring Jimmy Fallon,2024-08-15T04:14:00Z,171760,Jimmy Fallon,1
DlyfMSWDV98,https://youtu.be/DlyfMSWDV98,Foster The People: Lost In Space | The Tonight Show Starring Jimmy Fallon,The Tonight Show Starring Jimmy Fallon,2024-08-14T04:32:00Z,164299,Jimmy Fallon,1
-pbK0CiKbaY,https://youtu.be/-pbK0CiKbaY,Stephen Nedoroscik Talks Becoming a Viral Meme at Paris Olympics; Solves Rubik's Cube in 15 Seconds,The Tonight Show Starring Jimmy Fallon,2024-08-14T04:14:00Z,676315,Jimmy Fallon,1
bS31mkyeYiQ,https://youtu.be/bS31mkyeYiQ,Lawrence: Whatcha Want | The Tonight Show Starring Jimmy Fallon,The Tonight Show Starring Jimmy Fallon,2024-08-13T04:32:00Z,505010,Jimmy Fallon,1
T8q1d4LZb1Y,https://youtu.be/T8q1d4LZb1Y,Rachel Dratch Interrupts Jimmy's Monologue as Australian Olympic Breakdancer Raygun | Tonight Show,The Tonight Show Starring Jimmy Fallon,2024-08-13T03:41:05Z,3731972,Jimmy Fallon,1
pKohuVrRlWk,https://youtu.be/pKohuVrRlWk,"Team USA Wins Big at Paris Olympics, Celine Dion Denounces Trump's Campaign Song Choice",The Tonight Show Starring Jimmy Fallon,2024-08-13T03:34:41Z,377601,Jimmy Fallon,1
JVYTCAzSbtk,https://youtu.be/JVYTCAzSbtk,Keke Palmer Kicks Off a Family-Themed Round of Password with Meghan Trainor,The Tonight Show Starring Jimmy Fallon,2024-08-10T16:00:15Z,116225,Jimmy Fallon,1
pAWIFCylPsE,https://youtu.be/pAWIFCylPsE,Johnny Knoxville and Jimmy Face Off in a Voice Changing-Themed Round of Password,The Tonight Show Starring Jimmy Fallon,2024-08-07T16:00:47Z,108323,Jimmy Fallon,1
RtVRXntUNtE,https://youtu.be/RtVRXntUNtE,Lauren Graham and Jimmy Play a Gotcha-Themed Round of Password,The Tonight Show Starring Jimmy Fallon,2024-08-01T16:00:33Z,146092,Jimmy Fallon,1
6GFwJZld7c0,https://youtu.be/6GFwJZld7c0,Cardi B Accidentally Gave Charli xcx an Unfortunate Nickname | The Tonight Show,The Tonight Show Starring Jimmy Fallon,2024-07-31T14:00:05Z,189321,Jimmy Fallon,1
cPUqyw2dry0,https://youtu.be/cPUqyw2dry0,Howie Mandel and Jimmy Face Off in an Explosive Round of Password,The Tonight Show Starring Jimmy Fallon,2024-07-29T16:00:35Z,112243,Jimmy Fallon,1
cIqtFs6JJDA,https://youtu.be/cIqtFs6JJDA,Ice Spice: Did It First/Think U The Shit (Fart) | The Tonight Show Starring Jimmy Fallon,The Tonight Show Starring Jimmy Fallon,2024-07-27T04:50:00Z,257849,Jimmy Fallon,1
d7BnEyc5Oqk,https://youtu.be/d7BnEyc5Oqk,Nick Jonas Equates Disney Games to Love Island; Talks Jimmy Singing Mr. Brightside at Yankee Stadium,The Tonight Show Starring Jimmy Fallon,2024-07-27T03:58:00Z,126597,Jimmy Fallon,1
rmv6DtuFkWM,https://youtu.be/rmv6DtuFkWM,"Will Ferrell, Nick Jonas and Jimmy Perform a Song About Jorts | The Tonight Show",The Tonight Show Starring Jimmy Fallon,2024-07-27T03:42:00Z,811355,Jimmy Fallon,1
BaLSTejIu3o,https://youtu.be/BaLSTejIu3o,Christian Pulisic and Jimmy Create a Special Celebration Move for His Game at Yankee Stadium,The Tonight Show Starring Jimmy Fallon,2024-07-26T04:14:00Z,375000,Jimmy Fallon,1
Gr6EXDw2tzM,https://youtu.be/Gr6EXDw2tzM,HARDY: PSYCHO | The Tonight Show Starring Jimmy Fallon,The Tonight Show Starring Jimmy Fallon,2024-07-25T04:32:00Z,109550,Jimmy Fallon,1
SLpbQdtn6Qk,https://youtu.be/SLpbQdtn6Qk,"Matt Damon Sings ""Sweet Caroline"" with Jimmy; Talks The Instigators and Met Gala Mishap (Extended)",The Tonight Show Starring Jimmy Fallon,2024-07-25T03:58:00Z,344000,Jimmy Fallon,1
_i58EFr7Nfc,https://youtu.be/_i58EFr7Nfc,What's Behind Me? with Matt Damon | The Tonight Show Starring Jimmy Fallon,The Tonight Show Starring Jimmy Fallon,2024-07-25T03:50:00Z,157378,Jimmy Fallon,1
tN_3Yp-hD0k,https://youtu.be/tN_3Yp-hD0k,Ayra Starr: Last Heartbreak Song/Woman Commando | The Tonight Show Starring Jimmy Fallon,The Tonight Show Starring Jimmy Fallon,2024-07-24T04:32:00Z,489193,Jimmy Fallon,1
fuOqGlwAr0w,https://youtu.be/fuOqGlwAr0w,Ralph Macchio Talks Cobra Kai Final Season and Gifts Jimmy an Honorary Crew Jacket (Extended),The Tonight Show Starring Jimmy Fallon,2024-07-24T04:06:00Z,284229,Jimmy Fallon,1
sidIL8V83Cc,https://youtu.be/sidIL8V83Cc,Jimin: Who | The Tonight Show Starring Jimmy Fallon,The Tonight Show Starring Jimmy Fallon,2024-07-23T04:27:06Z,6711171,Jimmy Fallon,1
DnrIAyk6Nyg,https://youtu.be/DnrIAyk6Nyg,"Jimmy Got a Sneak Peek of BTS' Jimin's New Song ""Who"" in Studio | The Tonight Show",The Tonight Show Starring Jimmy Fallon,2024-07-23T03:46:16Z,903718,Jimmy Fallon,1
oXOmmjt9ARQ,https://youtu.be/oXOmmjt9ARQ,Robin Williams Named His Daughter After The Legend of Zelda | (Late Night with Jimmy Fallon),The Tonight Show Starring Jimmy Fallon,2024-07-21T14:00:37Z,262887,Jimmy Fallon,1
2fS7Vv0T9gQ,https://youtu.be/2fS7Vv0T9gQ,Glass Animals: Show Pony | The Tonight Show Starring Jimmy Fallon,The Tonight Show Starring Jimmy Fallon,2024-07-19T05:45:00Z,104573,Jimmy Fallon,1
Hsm0wtSBH2M,https://youtu.be/Hsm0wtSBH2M,Dave Bautista Talks Wrestling in the WWE and Working with Samuel L. Jackson | The Tonight Show,The Tonight Show Starring Jimmy Fallon,2024-07-19T04:00:16Z,424637,Jimmy Fallon,1
mcrf0-fIZhY,https://youtu.be/mcrf0-fIZhY,Clairo: Juna | The Tonight Show Starring Jimmy Fallon,The Tonight Show Starring Jimmy Fallon,2024-07-18T05:00:34Z,1456364,Jimmy Fallon,1
1Coe8t4IHUw,https://youtu.be/1Coe8t4IHUw,Tracy Morgan Wants to Compete in the Paris Olympics and Start an OnlyFans Page | The Tonight Show,The Tonight Show Starring Jimmy Fallon,2024-07-18T03:58:00Z,287386,Jimmy Fallon,1
vSjDUEwQaNM,https://youtu.be/vSjDUEwQaNM,"Call Between Trump and RFK Jr. Leaked, J.D. Vance Gives First Speech as Trump's Running Mate",The Tonight Show Starring Jimmy Fallon,2024-07-18T03:35:00Z,500520,Jimmy Fallon,1
KyLmi-HBErg,https://youtu.be/KyLmi-HBErg,BTS' Jimin Is Returning to The Tonight Show!,The Tonight Show Starring Jimmy Fallon,2024-07-17T16:36:40Z,413563,Jimmy Fallon,1
4XzBrSqvbzo,https://youtu.be/4XzBrSqvbzo,Fran Lebowitz Breaks Down Why Having Children Is Bad for the Environment | The Tonight Show,The Tonight Show Starring Jimmy Fallon,2024-07-17T04:06:00Z,196018,Jimmy Fallon,1
XK2Fx42kU58,https://youtu.be/XK2Fx42kU58,Julio Torres Impersonates Different Colors and Talks Fantasmas (Extended) | The Tonight Show,The Tonight Show Starring Jimmy Fallon,2024-07-16T04:14:00Z,140810,Jimmy Fallon,1
aJ8QSjTAR5Q,https://youtu.be/aJ8QSjTAR5Q,"Rihanna Helped Natalie Portman Deal with Her Divorce by Calling Her the ""Hottest B*tch""",The Tonight Show Starring Jimmy Fallon,2024-07-16T04:06:00Z,1376614,Jimmy Fallon,1
kSl3ngIk2ok,https://youtu.be/kSl3ngIk2ok,Catchphrase with Natalie Portman and Julio Torres | The Tonight Show Starring Jimmy Fallon,The Tonight Show Starring Jimmy Fallon,2024-07-16T03:58:00Z,108713,Jimmy Fallon,1
NyNpEcNbZM4,https://youtu.be/NyNpEcNbZM4,Phish: Evolve | The Tonight Show Starring Jimmy Fallon,The Tonight Show Starring Jimmy Fallon,2024-07-12T04:32:00Z,187873,Jimmy Fallon,1
4fRMWam51F4,https://youtu.be/4fRMWam51F4,"Pressure Mounts for Biden to Step Down, Trump and Biden Tied in New Poll | The Tonight Show",The Tonight Show Starring Jimmy Fallon,2024-07-12T03:40:00Z,183412,Jimmy Fallon,1
mof-L1BNz8A,https://youtu.be/mof-L1BNz8A,"Jimmy, The Roots and Phish in An Elevator (Cold Open) | The Tonight Show Starring Jimmy Fallon",The Tonight Show Starring Jimmy Fallon,2024-07-12T03:35:00Z,126951,Jimmy Fallon,1
bFYHRupfarU,https://youtu.be/bFYHRupfarU,Common & Pete Rock: When The Sun Shines Again ft. Posdnuos and Bilal | The Tonight Show,The Tonight Show Starring Jimmy Fallon,2024-07-11T04:32:00Z,200907,Jimmy Fallon,1
VO5U6ynFhWI,https://youtu.be/VO5U6ynFhWI,Ewan Mitchell Talks Filming Aemond Targaryen's Nude Scenes & Flying Dragons Alongside Fabien Frankel,The Tonight Show Starring Jimmy Fallon,2024-07-11T04:06:00Z,1170225,Jimmy Fallon,1
SecBYu5vht0,https://youtu.be/SecBYu5vht0,"Hannah Berner Stand-Up: Turning 30, Marrying Older Men | The Tonight Show Starring Jimmy Fallon",The Tonight Show Starring Jimmy Fallon,2024-07-10T04:32:00Z,169386,Jimmy Fallon,1
PL4UA_e363s,https://youtu.be/PL4UA_e363s,Sublime: Feel Like That | The Tonight Show Starring Jimmy Fallon,The Tonight Show Starring Jimmy Fallon,2024-07-09T04:32:00Z,657326,Jimmy Fallon,1
vVDxszGfkPw,https://youtu.be/vVDxszGfkPw,Whisper Challenge with Scarlett Johansson | The Tonight Show Starring Jimmy Fallon,The Tonight Show Starring Jimmy Fallon,2024-07-09T04:19:00Z,259130,Jimmy Fallon,1
CFVLd9lk4KA,https://youtu.be/CFVLd9lk4KA,"Scarlett Johansson Talks Not Wanting to go to Space, Reading Lines with Colin Jost (Extended)",The Tonight Show Starring Jimmy Fallon,2024-07-09T04:00:17Z,541084,Jimmy Fallon,1
XtRTA2yHmNM,https://youtu.be/XtRTA2yHmNM,"Trump-Biden Debate Fallout, Biden Refuses to Drop Out of 2024 Race | The Tonight Show",The Tonight Show Starring Jimmy Fallon,2024-07-09T03:35:00Z,438683,Jimmy Fallon,1
-BCKHEyRNFs,https://youtu.be/-BCKHEyRNFs,Steve Carell on His Most Iconic Anchorman Lines | Fallon Flashback (Late Night with Jimmy Fallon),The Tonight Show Starring Jimmy Fallon,2024-06-30T13:00:00Z,169396,Jimmy Fallon,1
