video_id,url,title,channel_name,published_at,view_count,persons_found,total_persons
wNeIUfsmEro,https://youtu.be/wNeIUfsmEro,"Super Right Wing vs McCarthy, Trump Loses ANOTHER Election & Prince William Fights Prince Harry",Jimmy Kimmel Live,2023-01-06T03:43:06Z,1788640,"Donald Trump,Jimmy Kimmel,Marjorie Taylor Greene,Matt Gaetz",4
NSeNpPZ5gF8,https://youtu.be/NSeNpPZ5gF8,"Embarrassing Day for House Republicans, Trump’s Tax Returns Released & Southwest Airlines Mess",Jimmy Kimmel Live,2023-01-04T03:34:10Z,1944149,"Donald Trump,George Santos,Jimmy Kimmel,Rudy Giuliani",4
Mvc_kif25_s,https://youtu.be/Mvc_kif25_s,"Miley Cyrus on New Phase of Her Life, Hannah Montana, Becoming a Disney Legend & Something Beautiful",Jimmy Kimmel Live,2025-05-23T06:00:17Z,917380,"Dua Lipa,Jimmy Kimmel,Miley Cyrus",3
afdVDBkCFuc,https://youtu.be/afdVDBkCFuc,Miley Cyrus – More to Lose,Jimmy Kimmel Live,2025-05-23T06:00:00Z,327022,"Dua Lipa,Jimmy Kimmel,Miley Cyrus",3
G33f3AZDec0,https://youtu.be/G33f3AZDec0,"Trump’s Big Beautiful Bill Passes the House, GOP Creeps Come Out in Force & Profiting Off Presidency",Jimmy Kimmel Live,2025-05-23T03:45:04Z,1898450,"Dua Lipa,Jimmy Kimmel,Mike Johnson",3
AdZyAuSmjhs,https://youtu.be/AdZyAuSmjhs,The Rabbit Hole with Jimmy Kimmel: Windmills,Jimmy Kimmel Live,2025-05-21T17:00:11Z,153064,"Donald Trump,Dua Lipa,Jimmy Kimmel",3
MISP7XrRhzw,https://youtu.be/MISP7XrRhzw,"Sarah Silverman on Jimmy Becoming a Grandfather, Having Lunch with Kanye West & New Netflix Special",Jimmy Kimmel Live,2025-05-21T06:00:25Z,416180,"Dua Lipa,Jimmy Kimmel,Kanye West",3
xCkPUQkhRFI,https://youtu.be/xCkPUQkhRFI,"Charlie Cox on Early Days in LA with Dornan, Pattinson, Garfield and Redmayne & Shooting Daredevil",Jimmy Kimmel Live,2025-05-07T06:00:52Z,224024,"Ben Affleck,Dua Lipa,Jimmy Kimmel",3
aJQQO88qeL0,https://youtu.be/aJQQO88qeL0,Nick Offerman on Falling in Love with Tom Cruise on Mission: Impossible – The Final Reckoning Set,Jimmy Kimmel Live,2025-05-07T06:00:00Z,454054,"Dua Lipa,Jimmy Kimmel,Tom Cruise",3
pO3Fwhs1cpQ,https://youtu.be/pO3Fwhs1cpQ,Trump Makes Hollywood Great Again & Canadian Prime Minister Shuts Down Becoming 51st State,Jimmy Kimmel Live,2025-05-07T03:45:04Z,2831279,"Dua Lipa,Jimmy Kimmel,Mark Carney",3
TFxl5fV47E4,https://youtu.be/TFxl5fV47E4,"Noah Wyle on The Pitt, Him and Clooney Failing at Being Real Doctors & We Test His Medical Knowledge",Jimmy Kimmel Live,2025-05-06T06:00:24Z,245982,"Dua Lipa,George Clooney,Jimmy Kimmel",3
wXXgaF_tUFk,https://youtu.be/wXXgaF_tUFk,"Trump Wants to be the Next Pope, Ruins Star Wars Day & Targets Hollywood with New Tariffs",Jimmy Kimmel Live,2025-05-06T03:45:04Z,2743096,"Dua Lipa,Elon Musk,Jimmy Kimmel",3
AfaNaxCXaOY,https://youtu.be/AfaNaxCXaOY,"Julia Louis-Dreyfus on Thunderbolts*, Meeting Pope Francis at Vatican & Wordle with Carol Burnett",Jimmy Kimmel Live,2025-04-30T06:00:08Z,277347,"Dua Lipa,Jimmy Kimmel,Pope Francis",3
wePKMVEF9so,https://youtu.be/wePKMVEF9so,"Thunderbolts* Cast David Harbour, Sebastian Stan, Florence Pugh, Wyatt Russell & Hannah John-Kamen",Jimmy Kimmel Live,2025-04-29T06:00:45Z,1622981,"Donald Trump,Dua Lipa,Jimmy Kimmel",3
d1FlXLVpK-o,https://youtu.be/d1FlXLVpK-o,"Billy Idol on His Signature Snarl, If Rebel Yell is About Demi Moore & New Documentary on His Life",Jimmy Kimmel Live,2025-04-29T06:00:35Z,219691,"Billie Eilish,Dua Lipa,Jimmy Kimmel",3
SF8LtFiBBAw,https://youtu.be/SF8LtFiBBAw,Hegseth SLAMS Leakers After Text Fallout & Jimmy Chats with Viral Twins Who Talk at the Same Time,Jimmy Kimmel Live,2025-04-23T03:45:02Z,2435933,"Dua Lipa,Jimmy Kimmel,Pete Hegseth",3
89uNkIHMtWU,https://youtu.be/89uNkIHMtWU,"Chris Hayes on Republicans Questioning Trump, Pete Hegseth Drama & Downloading TikTok for Research",Jimmy Kimmel Live,2025-04-22T06:00:09Z,524368,"Dua Lipa,Jimmy Kimmel,Pete Hegseth",3
toU4bMGS6Xc,https://youtu.be/toU4bMGS6Xc,"Trump Won’t Bring Back Mistakenly Deported Man, Elon’s Baby Making Quest & MyPillow Mike Evicted",Jimmy Kimmel Live,2025-04-17T03:45:11Z,2470524,"Dua Lipa,Elon Musk,Jimmy Kimmel",3
_Np27wLbxbg,https://youtu.be/_Np27wLbxbg,"Trump Runs the Market into the Ground Again, Obsesses Over Showers & His Ass Kisser of the Week",Jimmy Kimmel Live,2025-04-11T03:45:05Z,3507906,"Donald Trump,Dua Lipa,Jimmy Kimmel",3
LA8CHny8dRM,https://youtu.be/LA8CHny8dRM,"MAGA Nuts Want Trump on Mount Rushmore, JFK Files Get Disorganized Release & Musk Wants Sympathy",Jimmy Kimmel Live,2025-03-20T03:45:01Z,2961238,"Dua Lipa,Elon Musk,Jimmy Kimmel",3
oRxUF1HmHSQ,https://youtu.be/oRxUF1HmHSQ,"Rachel Zegler on Auditioning for Snow White, Her Parents Being Huge Disney Fans & Evita in London",Jimmy Kimmel Live,2025-03-18T06:00:26Z,193383,"Dua Lipa,Jimmy Kimmel,Steven Spielberg",3
wmRN364Xe5k,https://youtu.be/wmRN364Xe5k,"Trump Starts Trade Wars with Our Allies, Musk Empties Pockets for MAGA & Stocks Keep Dipping",Jimmy Kimmel Live,2025-03-14T03:45:05Z,3559883,"Dua Lipa,Elon Musk,Jimmy Kimmel",3
PYH0tYY6xn8,https://youtu.be/PYH0tYY6xn8,"Ray Nicholson on Sitting Courtside with Dad Jack, Being Pants’d by Kobe & Leveled by Kevin Garnett",Jimmy Kimmel Live,2025-03-13T06:00:23Z,112815,"Dua Lipa,Jimmy Kimmel,Margot Robbie",3
Jk-E81Kd_ls,https://youtu.be/Jk-E81Kd_ls,"SZA on Touring with Kendrick Lamar, New Movie One of Them Days & Her Fascination with Bugs",Jimmy Kimmel Live,2025-03-12T06:00:16Z,263627,"Dua Lipa,Jimmy Kimmel,Kendrick Lamar",3
_N93dxPZExA,https://youtu.be/_N93dxPZExA,"Trump Walks Back Tariffs, Wants to Dismantle Dept of Education & Plans to Deport 200,000 Ukrainians",Jimmy Kimmel Live,2025-03-07T04:45:02Z,3299961,"Dua Lipa,Elon Musk,Jimmy Kimmel",3
_b_Kflef2-8,https://youtu.be/_b_Kflef2-8,"Danny McBride on Being Compared to Mahomes, Walton Goggins’ Penis Doubles & The Righteous Gemstones",Jimmy Kimmel Live,2025-03-05T07:00:17Z,415063,"Dua Lipa,Jimmy Kimmel,Patrick Mahomes",3
ZiE1pDsDo70,https://youtu.be/ZiE1pDsDo70,"Ben Stiller on Severance Theories, Trying to Cast Obama & Presenting at Oscars During Knicks Game",Jimmy Kimmel Live,2025-03-04T07:00:21Z,554301,"Barack Obama,Dua Lipa,Jimmy Kimmel",3
_LV4rXSEE40,https://youtu.be/_LV4rXSEE40,"Team Trump Screws Up Epstein List Release, Donald Hocks Golden Dollars & GOP Complains About Elon",Jimmy Kimmel Live,2025-02-28T04:45:02Z,3381809,"Dua Lipa,Elon Musk,Jimmy Kimmel",3
z9IgJIz0Eg0,https://youtu.be/z9IgJIz0Eg0,"Trump Clears Up Musk's Ultimatum Email, Marjorie Taylor Greene vs Federal Workers & Gross DeSantis",Jimmy Kimmel Live,2025-02-26T04:45:03Z,2121093,"Dua Lipa,Jimmy Kimmel,Marjorie Taylor Greene",3
4xGUlG5Ck6c,https://youtu.be/4xGUlG5Ck6c,"Trump & Musk Fire Thousands of Federal Workers, Donny Gets a New Tell-All & Macron Visits Washington",Jimmy Kimmel Live,2025-02-25T04:45:00Z,3200282,"Dua Lipa,Jimmy Kimmel,Rudy Giuliani",3
vD65TYAIHzk,https://youtu.be/vD65TYAIHzk,Lizzy Caplan on Crazy Bikini Waxing Experience & Does She Remember Her Lines from Mean Girls?,Jimmy Kimmel Live,2025-02-12T07:00:40Z,237463,"Dua Lipa,Jimmy Kimmel,Robert De Niro",3
RLm7w1ZcYFI,https://youtu.be/RLm7w1ZcYFI,"Rob Lowe on Michael Jackson Requesting His Chin, Demi Moore’s Oscar Nomination & NFL Hat Meme",Jimmy Kimmel Live,2025-02-07T07:00:14Z,207201,"Dua Lipa,Jimmy Fallon,Jimmy Kimmel",3
0McLoZ0yntM,https://youtu.be/0McLoZ0yntM,Trump Pretends to Be Christian at National Prayer Breakfast & Guillermo Talks to Super Bowl Players,Jimmy Kimmel Live,2025-02-07T04:45:00Z,2583023,"Donald Trump,Dua Lipa,Jimmy Kimmel",3
6NNGbkwJJ8I,https://youtu.be/6NNGbkwJJ8I,"Ariana Grande on Wicked Oscar Nom, Training for the Role of Glinda & She Answers Questions from Kids",Jimmy Kimmel Live,2025-02-06T07:00:06Z,992685,"Ariana Grande,Dua Lipa,Jimmy Kimmel",3
Sk2FyT0rYss,https://youtu.be/Sk2FyT0rYss,Ariana Grande Sings a Song We Wrote That She’s NEVER Seen Before,Jimmy Kimmel Live,2025-02-06T05:30:09Z,879892,"Ariana Grande,Dua Lipa,Jimmy Kimmel",3
bXDTViC0zfA,https://youtu.be/bXDTViC0zfA,Trump Gives Doozy of a Press Conference About Gaza & Ariana Grande Sings a Song She’s Never Seen,Jimmy Kimmel Live,2025-02-06T04:45:02Z,2492172,"Ariana Grande,Dua Lipa,Jimmy Kimmel",3
nSs7_10VuSw,https://youtu.be/nSs7_10VuSw,"Trump Backs Off of Tariffs, Senate Advances RFK Jr & We Send LA Firefighters to the Super Bowl",Jimmy Kimmel Live,2025-02-05T04:45:03Z,2878613,"Dua Lipa,Jimmy Kimmel,Travis Kelce",3
U7g5RxMUzm4,https://youtu.be/U7g5RxMUzm4,Harrison Ford & Jimmy Kimmel Take Compatibility Test and Talk Captain America: Brave New World,Jimmy Kimmel Live,2025-02-04T07:00:14Z,528670,"Dua Lipa,Harrison Ford,Jimmy Kimmel",3
wa5xjn2URYk,https://youtu.be/wa5xjn2URYk,"Katy Perry on The Lifetimes Tour, Taking Her Daughter Daisy Around the World & Stage Diving in 2003",Jimmy Kimmel Live,2025-01-30T07:00:37Z,205738,"Dua Lipa,Jimmy Kimmel,Katy Perry",3
1H8C0acqHbg,https://youtu.be/1H8C0acqHbg,"RFK Jr.’s Day to Crazy it Up, Team Trump’s Big Self-Made Mess & Newsom on Donald's Fake Water Pump",Jimmy Kimmel Live,2025-01-30T04:45:00Z,2774661,"Dua Lipa,Gavin Newsom,Jimmy Kimmel",3
RmgxMqeW0TI,https://youtu.be/RmgxMqeW0TI,"Trump Saves California with WATER, Plans to Build an Iron Dome & People Want Him on Mount Rushmore!?",Jimmy Kimmel Live,2025-01-29T04:45:01Z,2447204,"Dua Lipa,Jimmy Kimmel,Karoline Leavitt",3
C__OgNlq5pU,https://youtu.be/C__OgNlq5pU,Trump’s Despicable Disaster Relief Conditions & Republicans Hard at Work Re-Investigating January 6,Jimmy Kimmel Live,2025-01-24T04:45:02Z,2398618,"Dua Lipa,Jimmy Kimmel,Pete Hegseth",3
mHKVSQq-dyE,https://youtu.be/mHKVSQq-dyE,"Sterling K. Brown on Doing Ayahuasca with His Wife, Meeting Michelle Obama & the Great Pizza Debate",Jimmy Kimmel Live,2025-01-22T07:00:25Z,109153,"Dua Lipa,Jimmy Kimmel,Michelle Obama",3
L29L7QAJV8o,https://youtu.be/L29L7QAJV8o,"Jayson Tatum on Idolizing Kobe, Embarrassing Moment with Michael Jordan & Being Close with His Mom",Jimmy Kimmel Live,2025-01-22T07:00:11Z,185723,"Dua Lipa,Jimmy Kimmel,Michael Jordan",3
G_Hggizn4H0,https://youtu.be/G_Hggizn4H0,"Trump Signs Slew of Crazy Executive Orders, Gets Mad at Church & a Shocking Lie Witness News",Jimmy Kimmel Live,2025-01-22T04:45:01Z,3968458,"Donald Trump,Dua Lipa,Jimmy Kimmel",3
uhayGIgTkvA,https://youtu.be/uhayGIgTkvA,"Snoop Dogg on the Fires in Los Angeles, What He’s Like in an Emergency & Meeting Paul McCartney",Jimmy Kimmel Live,2025-01-14T07:00:37Z,1462933,"Dua Lipa,Jimmy Kimmel,Snoop Dogg",3
8OEzGwaXr0Q,https://youtu.be/8OEzGwaXr0Q,Cher on Talking About Her Relationships in Memoir & She Answers Rapid Fire Questions About Her Life,Jimmy Kimmel Live,2025-01-08T07:00:06Z,936320,"Dua Lipa,Jimmy Carter,Jimmy Kimmel",3
nz00dgmdPvg,https://youtu.be/nz00dgmdPvg,"Selena Gomez on Engagement to Benny Blanco, Martin Short & Steve Martin’s Reactions & Emilia Pérez",Jimmy Kimmel Live,2025-01-07T07:00:22Z,1246059,"Dua Lipa,Jimmy Kimmel,Selena Gomez",3
KkJYw1ZdzfA,https://youtu.be/KkJYw1ZdzfA,"Trump Named Time’s Person of the Year, Biden Issues Pardons & What NOT to Do at Office Xmas Parties",Jimmy Kimmel Live,2024-12-13T04:45:01Z,1871115,"Dua Lipa,Jimmy Kimmel,Joe Biden",3
PrpNdqLtZuw,https://youtu.be/PrpNdqLtZuw,"Nikki Glaser on Hosting the Golden Globes, Life After Roasting Tom Brady & Bombing for Billionaires",Jimmy Kimmel Live,2024-12-12T07:00:18Z,733635,"Dua Lipa,Jimmy Kimmel,Tom Brady",3
Kiv_gdDfckg,https://youtu.be/Kiv_gdDfckg,"Trump's Rambling Lying Meet the Press Interview, Trip to Paris & Suspected Healthcare Killer Caught",Jimmy Kimmel Live,2024-12-10T04:45:01Z,2900639,"Dua Lipa,Jill Biden,Jimmy Kimmel",3
xOqXoDp9akg,https://youtu.be/xOqXoDp9akg,Billy Eichner on Meeting Travis Kelce at Madonna’s Party & Recording Mufasa Movie with Seth Rogen,Jimmy Kimmel Live,2024-12-06T07:00:35Z,105676,"Dua Lipa,Jimmy Kimmel,Travis Kelce",3
3SLI78zfQto,https://youtu.be/3SLI78zfQto,"Trump Heading to Notre Dame in Paris, GOP's Pretend Outrage Over Hunter & California Trump Proofs",Jimmy Kimmel Live,2024-12-04T04:45:00Z,1929114,"Dua Lipa,Gavin Newsom,Jimmy Kimmel",3
Nh3_ey4Nt44,https://youtu.be/Nh3_ey4Nt44,Lie Witness News – Trump Cabinet Edition,Jimmy Kimmel Live,2024-11-28T03:30:15Z,133071,"Donald Trump,Dua Lipa,Jimmy Kimmel",3
4vdWjpNcsGU,https://youtu.be/4vdWjpNcsGU,"Kathy Griffin on Party at Paris Hilton’s House, Bumping into The Rock & Chicago New Years Eve Show",Jimmy Kimmel Live,2024-11-27T07:00:03Z,230709,"Dua Lipa,Jimmy Kimmel,Paris Hilton",3
vbZIehlQ3FI,https://youtu.be/vbZIehlQ3FI,"Jim Gaffigan on Playing Tim Walz on SNL, Getting Skinny & Meeting the Pope with a Bunch of Comedians",Jimmy Kimmel Live,2024-11-22T07:00:34Z,574601,"Dua Lipa,Jimmy Kimmel,Tim Walz",3
cVVFV28aesU,https://youtu.be/cVVFV28aesU,"Ralph Macchio on Working with De Niro & Pesci, Being in a Coldplay Video & Chris Martin Surprise!",Jimmy Kimmel Live,2024-11-21T07:00:19Z,362350,"Dua Lipa,Jimmy Kimmel,Robert De Niro",3
UKhNCRRRfCo,https://youtu.be/UKhNCRRRfCo,Blake Shelton on Releasing Music at Same Time as Wife Gwen Stefani & Embarrassing Bike Photo in Rome,Jimmy Kimmel Live,2024-11-21T07:00:14Z,185320,"Blake Shelton,Dua Lipa,Jimmy Kimmel",3
QLWyWDz8TO0,https://youtu.be/QLWyWDz8TO0,Blake Shelton – Texas,Jimmy Kimmel Live,2024-11-21T07:00:13Z,120357,"Blake Shelton,Dua Lipa,Jimmy Kimmel",3
hJaz12hx1aA,https://youtu.be/hJaz12hx1aA,"Denzel Washington on Mike Tyson vs Jake Paul, Meeting King Charles, Gladiator II & Retirement Rumors",Jimmy Kimmel Live,2024-11-19T07:00:22Z,1804318,"Dua Lipa,Jimmy Kimmel,King Charles",3
7EdjsuPHVkI,https://youtu.be/7EdjsuPHVkI,"Don Johnson on His Daughter Dakota Pranking Him, Miami Vice Auditions & Doctor Odyssey",Jimmy Kimmel Live,2024-11-08T07:00:06Z,377319,"Dua Lipa,Jimmy Kimmel,Johnny Depp",3
WQuVvoR8Vig,https://youtu.be/WQuVvoR8Vig,Trump Minion Elon Musk Calls Jimmy a Propaganda Puppet & MAGA Floats Baseless Election Conspiracies,Jimmy Kimmel Live,2024-11-08T04:45:02Z,4432989,"Dua Lipa,Elon Musk,Jimmy Kimmel",3
gyqCAdItpX8,https://youtu.be/gyqCAdItpX8,"Allison Janney on Starting a Celebrity Band, Playing VP on The Diplomat & Suspicious Ring Footage",Jimmy Kimmel Live,2024-11-05T07:00:20Z,169391,"Dua Lipa,Hillary Clinton,Jimmy Kimmel",3
tlum8JOlg0w,https://youtu.be/tlum8JOlg0w,Olivia Rodrigo Surprises Trick-or-Treaters,Jimmy Kimmel Live,2024-11-01T04:30:31Z,1790715,"Dua Lipa,Jimmy Kimmel,Olivia Rodrigo",3
QeuU9P3f9lY,https://youtu.be/QeuU9P3f9lY,"Trump’s Garbage Truck Fail, JD Vance on “Normal” Gay Guy Vote & Dodgers Beat Yankees",Jimmy Kimmel Live,2024-11-01T03:45:01Z,3116876,"Dua Lipa,Jimmy Kimmel,Tucker Carlson",3
iB8jqkMLnM0,https://youtu.be/iB8jqkMLnM0,Howie Long & Terry Bradshaw on Tom Brady Being a Broadcaster & Terry’s Nude Scene with McConaughey,Jimmy Kimmel Live,2024-10-29T06:00:21Z,187359,"Dua Lipa,Jimmy Kimmel,Tom Brady",3
GGxwn_N9DtE,https://youtu.be/GGxwn_N9DtE,Dave Bautista Shreds Trump’s Masculinity,Jimmy Kimmel Live,2024-10-18T14:00:12Z,2967960,"Donald Trump,Dua Lipa,Jimmy Kimmel",3
v3KMM6sl2P8,https://youtu.be/v3KMM6sl2P8,"Niecy Nash-Betts on Co-Star Travis Kelce, Being Fired from McDonald’s & Making Love in 26 Countries",Jimmy Kimmel Live,2024-10-18T06:00:36Z,179893,"Dua Lipa,Jimmy Kimmel,Travis Kelce",3
Y8nKmgguH7M,https://youtu.be/Y8nKmgguH7M,"Trump Grilled by Latino Voters, Brags About His “Fertile Mind” & Lawyers Try to Pay Off Stormy AGAIN",Jimmy Kimmel Live,2024-10-18T03:45:01Z,4526296,"Dua Lipa,Jimmy Kimmel,Stormy Daniels",3
PpbKWFehKyE,https://youtu.be/PpbKWFehKyE,"Trump’s Mad at “Loser” Jimmy Kimmel Again, Holds a DOOZY of a Town Hall & Attacks Kamala’s Health",Jimmy Kimmel Live,2024-10-16T03:45:01Z,5205607,"Donald Trump,Dua Lipa,Jimmy Kimmel",3
NQEKgoIr_6A,https://youtu.be/NQEKgoIr_6A,"Trump Gets More Erratic, Doubles Down on Kamala & Do MAGA Voters Even KNOW What They're Against?",Jimmy Kimmel Live,2024-10-15T03:45:00Z,4659830,"Dua Lipa,Jimmy Kimmel,Kamala Harris",3
Ef5SDHlgMYk,https://youtu.be/Ef5SDHlgMYk,"Jessica Williams on Getting to Know Harrison Ford, Working on The Daily Show & Texting with Her Mom",Jimmy Kimmel Live,2024-10-11T06:00:07Z,146827,"Dua Lipa,Harrison Ford,Jimmy Kimmel",3
tZ5hEZzWMvE,https://youtu.be/tZ5hEZzWMvE,"Henry Winkler on Reunion with Ron Howard, Evacuating a Dublin Hotel & Meeting Queen Camilla",Jimmy Kimmel Live,2024-10-10T06:00:34Z,238833,"Dua Lipa,Jimmy Kimmel,Queen Camilla",3
KOfiq4kDdV8,https://youtu.be/KOfiq4kDdV8,"Harrison Ford on Actors He Was Intimidated By, Working as a Cook & Season Two of Shrinking",Jimmy Kimmel Live,2024-10-09T06:00:08Z,1061468,"Dua Lipa,Harrison Ford,Jimmy Kimmel",3
chIsUyT5mVg,https://youtu.be/chIsUyT5mVg,"Trump's MELTDOWN Over New Election Fraud Evidence, Melania's Abortion Stance & GOP Hypocrisy is REAL",Jimmy Kimmel Live,2024-10-04T03:45:04Z,5148725,"Dua Lipa,Jimmy Kimmel,Joe Biden",3
EE8jEXXCFWg,https://youtu.be/EE8jEXXCFWg,"Lady Gaga on Getting Engaged, Playing Harley Quinn in Joker: Folie à Deux & New Harlequin Album",Jimmy Kimmel Live,2024-10-02T06:00:05Z,1339266,"Dua Lipa,Jimmy Kimmel,Lady Gaga",3
3o4oqFCQTvw,https://youtu.be/3o4oqFCQTvw,Jimmy Kimmel Breaks Down the Vice Presidential Debate Between JD Vance & Tim Walz,Jimmy Kimmel Live,2024-10-02T04:31:02Z,3749978,"Dua Lipa,Jimmy Kimmel,Tim Walz",3
x_wmmu0wffw,https://youtu.be/x_wmmu0wffw,"Mookie Betts on Playing with Ohtani, Dodgers in the Playoffs & Haunted Milwaukee Hotel",Jimmy Kimmel Live,2024-10-01T06:00:35Z,238618,"Dua Lipa,Jimmy Kimmel,Shohei Ohtani",3
xPt3N2p-qss,https://youtu.be/xPt3N2p-qss,"Trump’s Weekend of CRAZY Outbursts, He Calls Kamala Mentally Impaired & Tim Walz vs MyPillow Mike",Jimmy Kimmel Live,2024-10-01T03:45:03Z,3296167,"Dua Lipa,Jimmy Kimmel,Tim Walz",3
lhPKtVfLiW0,https://youtu.be/lhPKtVfLiW0,"Sebastian Stan on Playing a Young Donald Trump, Marvel’s Thunderbolts* & New Film A Different Man",Jimmy Kimmel Live,2024-09-26T06:00:32Z,469977,"Donald Trump,Dua Lipa,Jimmy Kimmel",3
W-hEGN4zrEk,https://youtu.be/W-hEGN4zrEk,"Trump Throws Fit Over Kamala's McDonald’s Job, Iran Threats & Do Men Know About Reproductive Rights?",Jimmy Kimmel Live,2024-09-26T03:42:58Z,3609963,"Dua Lipa,Jimmy Kimmel,Kamala Harris",3
Zi1pv4PWa8w,https://youtu.be/Zi1pv4PWa8w,"Peter Krause on Living Next to Kristen Bell & Dax Shepard, Mountain Lion Encounter & 9-1-1 on ABC",Jimmy Kimmel Live,2024-09-20T06:00:15Z,177096,"Dua Lipa,Jimmy Kimmel,Tim Walz",3
9Ue2bY09_lU,https://youtu.be/9Ue2bY09_lU,"Trump's Wild Debate Conspiracies, Former GOP Leaders for Kamala, MAGA Fashion Show & iPhone Prank",Jimmy Kimmel Live,2024-09-19T03:45:00Z,3419570,"Dua Lipa,Jimmy Kimmel,Kamala Harris",3
UKYOC1f-BV4,https://youtu.be/UKYOC1f-BV4,Guillermo Back-to-Back at the Emmys,Jimmy Kimmel Live,2024-09-17T06:02:19Z,135293,"Dua Lipa,Jimmy Kimmel,Will Smith",3
gXvLN9UV44k,https://youtu.be/gXvLN9UV44k,"James Adomian on Playing MyPillow Mike Lindell, Bernie Sanders Impression & His First Comedy Special",Jimmy Kimmel Live,2024-09-12T06:00:28Z,115923,"Bernie Sanders,Dua Lipa,Jimmy Kimmel",3
PiVcVLYzeQM,https://youtu.be/PiVcVLYzeQM,George Conway on Kamala Harris’ Beatdown of Trump at the Debate & Being One of His Biggest Enemies,Jimmy Kimmel Live,2024-09-11T05:25:29Z,2761351,"Dua Lipa,Jimmy Kimmel,Kamala Harris",3
z_uIdRjIR_g,https://youtu.be/z_uIdRjIR_g,"Doug Emhoff on Kamala Becoming Presidential Candidate, Nerves Before DNC Speech & Embracing Tim Walz",Jimmy Kimmel Live,2024-09-06T06:00:35Z,1561967,"Dua Lipa,Jimmy Kimmel,Tim Walz",3
oBPQxNCksCk,https://youtu.be/oBPQxNCksCk,"Peter Dinklage on Shaving His Beard, Loving Springsteen & Working with Metallica's James Hetfield",Jimmy Kimmel Live,2024-09-05T06:00:22Z,572971,"Bruce Springsteen,Dua Lipa,Jimmy Kimmel",3
lhCqiccWBXY,https://youtu.be/lhCqiccWBXY,"Adam Kinzinger on Trump’s Stunt at Arlington, His Body Odor & Republicans Scared to Speak Out",Jimmy Kimmel Live,2024-09-04T06:00:24Z,2177358,"Donald Trump,Dua Lipa,Jimmy Kimmel",3
K10vw7X7afo,https://youtu.be/K10vw7X7afo,Billie Eilish on Growing Up with Her Fans & Exclusive Clip: Making Birds of a Feather with FINNEAS,Jimmy Kimmel Live,2024-09-04T06:00:10Z,1774370,"Billie Eilish,Dua Lipa,Jimmy Kimmel",3
wmy41YRtGd8,https://youtu.be/wmy41YRtGd8,"Maya Rudolph on Playing VP Kamala Harris on SNL, Coming from a Show Biz Family & Her Love for RuPaul",Jimmy Kimmel Live,2024-08-20T06:00:26Z,942505,"Dua Lipa,Jimmy Kimmel,Kamala Harris",3
aFCyO05Tiss,https://youtu.be/aFCyO05Tiss,Guest Host Lamorne Morris on Trump & Biden’s Speeches and He Helps Sell Someone's Crap on Craigslist,Jimmy Kimmel Live,2024-07-26T03:45:00Z,312235,"Donald Trump,Dua Lipa,Jimmy Kimmel",3
vPKrGp3maPk,https://youtu.be/vPKrGp3maPk,"Ken Jeong on Flying During a Medical Emergency, Wrestling with John Cena & The Masked Singer",Jimmy Kimmel Live,2024-07-19T06:00:27Z,200467,"Dua Lipa,Jimmy Kimmel,Matt Gaetz",3
XamzaUZ_b2Y,https://youtu.be/XamzaUZ_b2Y,"Nikki Glaser on Following Taylor Swift Around Europe, People Trolling Her & Becoming a Musician",Jimmy Kimmel Live,2024-07-12T06:00:22Z,457084,"Dua Lipa,Jimmy Kimmel,Taylor Swift",3
Jg9bcEHUew4,https://youtu.be/Jg9bcEHUew4,"Guest Host Kumail Nanjiani on Trump Bashing Clooney, Biden at NATO & a VERY Honest Graduation Speech",Jimmy Kimmel Live,2024-07-12T03:45:01Z,631274,"Dua Lipa,George Clooney,Jimmy Kimmel",3
y5fbk_E3B_Y,https://youtu.be/y5fbk_E3B_Y,"Joe Locke on Keeping Marvel Secrets for Agatha All Along, His Broadway Debut & Taylor Swift Concert",Jimmy Kimmel Live,2024-07-11T06:00:32Z,828705,"Dua Lipa,Jimmy Kimmel,Taylor Swift",3
Qn-P7UdqkfY,https://youtu.be/Qn-P7UdqkfY,"Trump and Biden are NOT the Same, Syphilis Skyrockets and We Need Ben & JLo to Work!",Jimmy Kimmel Live,2024-07-10T03:45:01Z,242719,"Dua Lipa,Jimmy Kimmel,Joe Biden",3
yxUJ3Gm1g0I,https://youtu.be/yxUJ3Gm1g0I,Guest Host Kathryn Hahn on Calls for Biden to Exit Presidential Race & Her One Woman Star Wars Show,Jimmy Kimmel Live,2024-07-09T03:45:02Z,390647,"Dua Lipa,Jimmy Kimmel,Joe Biden",3
u5ej9A0JbIc,https://youtu.be/u5ej9A0JbIc,Jake Byrd at the Courthouse for the Trump Verdict,Jimmy Kimmel Live,2024-07-05T03:00:39Z,230914,"Donald Trump,Dua Lipa,Jimmy Kimmel",3
xku08zGdxGA,https://youtu.be/xku08zGdxGA,Jiminy Glick’s Musical Salute to Donald Trump,Jimmy Kimmel Live,2024-06-28T03:45:04Z,803097,"Donald Trump,Dua Lipa,Jimmy Kimmel",3
B8SSpRxA4c0,https://youtu.be/B8SSpRxA4c0,Beck on Getting Denied Entry to a Party with Paul McCartney & Bringing Leaf Blowers on Stage,Jimmy Kimmel Live,2024-06-27T06:00:07Z,314771,"Dua Lipa,Jimmy Kimmel,Selena Gomez",3
1__IO93Xmiw,https://youtu.be/1__IO93Xmiw,"Selena Gomez on Only Murders, Working with Meryl Streep & She Does Martin Short’s Makeup",Jimmy Kimmel Live,2024-06-27T06:00:01Z,1463275,"Dua Lipa,Jimmy Kimmel,Selena Gomez",3
bLmqTbenE28,https://youtu.be/bLmqTbenE28,Guest Host Martin Short on Trump and Biden Debate & Jiminy Glick Interviews Sean Hayes,Jimmy Kimmel Live,2024-06-27T03:45:02Z,873290,"Donald Trump,Dua Lipa,Jimmy Kimmel",3
vleEAnsOIvs,https://youtu.be/vleEAnsOIvs,Guest Host Martin Short Delivers Contractually Obligated Trump Jokes & Introduces New Energy Drink,Jimmy Kimmel Live,2024-06-26T03:45:03Z,913492,"Dua Lipa,Jimmy Kimmel,Melania Trump",3
cojbcUQjDlc,https://youtu.be/cojbcUQjDlc,"Sienna Miller on Meeting Martin Short & Steve Martin, Curb Your Enthusiasm & Working with Costner",Jimmy Kimmel Live,2024-06-25T06:00:30Z,184934,"Dua Lipa,Jimmy Kimmel,Kevin Costner",3
sRbSwsVP5-w,https://youtu.be/sRbSwsVP5-w,"Steve Martin on Why He Loves Martin Short, Only Murders Season 4 & Poached Egg Obsession",Jimmy Kimmel Live,2024-06-25T06:00:19Z,1178223,"Dua Lipa,Jimmy Kimmel,Selena Gomez",3
rIjJGDKxLmg,https://youtu.be/rIjJGDKxLmg,Congresswoman Jasmine Crockett on “Bleach-Blonde Bad-Built Butch-Body” Marjorie Taylor Greene,Jimmy Kimmel Live,2024-06-21T06:00:30Z,3176720,"Dua Lipa,Jimmy Kimmel,Marjorie Taylor Greene",3
QG2DtPYarTI,https://youtu.be/QG2DtPYarTI,"Zac Efron on Taking a Trip to the North Pole, Working with Nicole Kidman & Monologues at Acting Camp",Jimmy Kimmel Live,2024-06-21T06:00:12Z,345189,"Dua Lipa,Jimmy Kimmel,Nicole Kidman",3
re51hMix8c4,https://youtu.be/re51hMix8c4,"Trump Has Done More for Black Americans Than Anyone, Don Jr’s Weird “Joe Biden” Voice & Who’s High?",Jimmy Kimmel Live,2024-06-20T03:45:04Z,2075851,"Dua Lipa,Jimmy Kimmel,Joe Biden",3
6Nkno7Sjotk,https://youtu.be/6Nkno7Sjotk,New Trump Tell-All Details Unhinged Behavior & Fox News Making Excuses in Case Biden Wins Debate,Jimmy Kimmel Live,2024-06-19T03:45:00Z,2030459,"Dua Lipa,Jimmy Kimmel,Rudy Giuliani",3
VCPBNZwFBf0,https://youtu.be/VCPBNZwFBf0,"Trump Seeks Black Support, Posts Nasty Father’s Day Message & Dads Fail When Asked About Their Kids",Jimmy Kimmel Live,2024-06-18T03:45:01Z,2080714,"Donald Trump,Dua Lipa,Jimmy Kimmel",3
vbsUb-Mw0Eo,https://youtu.be/vbsUb-Mw0Eo,"Trump Turns 78 Years Old, Parasites Kiss His Ass in D.C. & We Ruin a Finals Game for a Celtics Fan",Jimmy Kimmel Live,2024-06-15T03:45:05Z,2192847,"Dua Lipa,Eric Trump,Jimmy Kimmel",3
R9ys0x9n0To,https://youtu.be/R9ys0x9n0To,"Trump Visits Republicans in Washington, Sells Fake and Cheap Bibles & Mitch McConnell Has No Spine",Jimmy Kimmel Live,2024-06-14T03:45:01Z,1917450,"Dua Lipa,Jimmy Kimmel,Joe Biden",3
l1ikSFts1cU,https://youtu.be/l1ikSFts1cU,"Tiffany Haddish on Meeting President Biden, Getting Arrested in Beverly Hills & Bad Boys 4",Jimmy Kimmel Live,2024-06-13T06:00:30Z,301319,"Dua Lipa,Jimmy Kimmel,Joe Biden",3
TVTHqECP4I8,https://youtu.be/TVTHqECP4I8,"Magic Johnson on Advice for Caitlin Clark, Inventing the High Five & Kobe Bryant vs Michael Jordan",Jimmy Kimmel Live,2024-06-07T06:00:11Z,446813,"Dua Lipa,Jimmy Kimmel,Michael Jordan",3
wpfcRFz5Ht4,https://youtu.be/wpfcRFz5Ht4,Trump's Massive Flip-Flop on Mail-In-Voting & Right Wingers Spew Poison for Pride,Jimmy Kimmel Live,2024-06-06T03:45:02Z,2115126,"Dua Lipa,Jimmy Kimmel,Joe Biden",3
